"No.","Time","Source","Destination","Protocol","Length","Info"
"1","0.000000","::","ff02::1:ff20:d383","ICMPv6","86","Neighbor Solicitation for fe80::b839:47ff:fe20:d383"
"2","0.113352","::","ff02::16","ICMPv6","90","Multicast Listener Report Message v2"
"3","0.132255","fe80::882f:b9ff:fe1b:941","ff02::fb","MDNS","203","Standard query response 0x0000 PTR, cache flush u20d-mate.local AAAA, cache flush fe80::882f:b9ff:fe1b:941"
"4","0.356466","fe80::1298:36ff:feaf:ef9a","ff02::16","ICMPv6","90","Multicast Listener Report Message v2"
"5","0.356557","fe80::1298:36ff:feaf:ef9a","ff02::2","ICMPv6","70","Router Solicitation from 10:98:36:af:ef:9a"
"6","0.384149","fe80::206:d7ff:fe37:44cf","ff02::16","ICMPv6","90","Multicast Listener Report Message v2"
"7","0.457352","fe80::882f:b9ff:fe1b:941","ff02::fb","MDNS","107","Standard query 0x0000 PTR _ipps._tcp.local, ""QM"" question PTR _ipp._tcp.local, ""QM"" question"
"8","0.544137","fe80::230:6eff:fe5c:4dbc","ff02::16","ICMPv6","90","Multicast Listener Report Message v2"
"9","0.544222","fe80::230:6eff:fe5c:4dbc","ff02::2","ICMPv6","70","Router Solicitation from 00:30:6e:5c:4d:bc"
"10","0.706638","0.0.0.0","255.255.255.255","DHCP","342","DHCP Request  - Transaction ID 0xe9702823"
"11","0.717901","HewlettP_5c:4d:bc","Broadcast","ARP","42","Who has 130.166.120.243? Tell 130.166.120.228"
"12","0.736234","HewlettP_5c:4d:bc","Broadcast","ARP","42","Who has 130.166.120.70? Tell 130.166.120.228"
"13","0.764067","fe80::7a3a:84ff:fe9c:e714","ff02::16","ICMPv6","90","Multicast Listener Report Message v2"
"14","0.764148","fe80::7a3a:84ff:fe9c:e714","ff02::2","ICMPv6","70","Router Solicitation from 78:3a:84:9c:e7:14"
"15","0.800347","fe80::206:d7ff:fe37:44cf","ff02::16","ICMPv6","150","Multicast Listener Report Message v2"
"16","0.860300","fe80::230:6eff:fe5c:4dbc","ff02::16","ICMPv6","90","Multicast Listener Report Message v2"
"17","0.864179","fe80::219:bbff:fe9b:59b","ff02::16","ICMPv6","90","Multicast Listener Report Message v2"
"18","0.864270","fe80::219:bbff:fe9b:59b","ff02::2","ICMPv6","70","Router Solicitation from 00:19:bb:9b:05:9b"
"19","0.924112","fe80::1298:36ff:feaf:ef9a","ff02::16","ICMPv6","90","Multicast Listener Report Message v2"
"20","0.956154","fe80::5ed2:e4ff:fe58:12fc","ff02::16","ICMPv6","90","Multicast Listener Report Message v2"
"21","0.956299","fe80::5ed2:e4ff:fe58:12fc","ff02::2","ICMPv6","70","Router Solicitation from 5c:d2:e4:58:12:fc"
"22","1.020061","fe80::b839:47ff:fe20:d383","ff02::16","ICMPv6","90","Multicast Listener Report Message v2"
"23","1.020081","fe80::b839:47ff:fe20:d383","ff02::2","ICMPv6","70","Router Solicitation from ba:39:47:20:d3:83"
"24","1.032078","fe80::b839:47ff:fe20:d383","ff02::16","ICMPv6","90","Multicast Listener Report Message v2"
"25","1.120972","fe80::b839:47ff:fe20:d383","ff02::fb","MDNS","107","Standard query 0x0000 PTR _ipps._tcp.local, ""QM"" question PTR _ipp._tcp.local, ""QM"" question"
"26","1.202473","fe80::b839:47ff:fe20:d383","ff02::fb","MDNS","215","Standard query 0x0000 ANY 3.8.3.d.0.2.e.f.f.f.7.4.9.3.8.b.0.0.0.0.0.0.0.0.0.0.0.0.0.8.e.f.ip6.arpa, ""QM"" question ANY u20d-mate.local, ""QM"" question AAAA fe80::b839:47ff:fe20:d383 PTR u20d-mate.local"
"27","1.263775","fe80::882f:b9ff:fe1b:941","ff02::fb","MDNS","203","Standard query response 0x0000 PTR, cache flush u20d-mate.local AAAA, cache flush fe80::882f:b9ff:fe1b:941"
"28","1.452472","fe80::b839:47ff:fe20:d383","ff02::fb","MDNS","215","Standard query 0x0000 ANY 3.8.3.d.0.2.e.f.f.f.7.4.9.3.8.b.0.0.0.0.0.0.0.0.0.0.0.0.0.8.e.f.ip6.arpa, ""QM"" question ANY u20d-mate.local, ""QM"" question AAAA fe80::b839:47ff:fe20:d383 PTR u20d-mate.local"
"29","1.500201","fe80::b839:47ff:fe20:d383","ff02::16","ICMPv6","110","Multicast Listener Report Message v2"
"30","1.504080","fe80::b839:47ff:fe20:d383","ff02::16","ICMPv6","90","Multicast Listener Report Message v2"
"31","1.564172","fe80::5ed2:e4ff:fe58:12fc","ff02::16","ICMPv6","90","Multicast Listener Report Message v2"
"32","1.628110","fe80::7a3a:84ff:fe9c:e714","ff02::16","ICMPv6","90","Multicast Listener Report Message v2"
"33","1.632097","fe80::219:bbff:fe9b:59b","ff02::16","ICMPv6","90","Multicast Listener Report Message v2"
"34","1.702425","fe80::b839:47ff:fe20:d383","ff02::fb","MDNS","215","Standard query 0x0000 ANY 3.8.3.d.0.2.e.f.f.f.7.4.9.3.8.b.0.0.0.0.0.0.0.0.0.0.0.0.0.8.e.f.ip6.arpa, ""QM"" question ANY u20d-mate.local, ""QM"" question AAAA fe80::b839:47ff:fe20:d383 PTR u20d-mate.local"
"35","1.902745","fe80::b839:47ff:fe20:d383","ff02::fb","MDNS","203","Standard query response 0x0000 PTR, cache flush u20d-mate.local AAAA, cache flush fe80::b839:47ff:fe20:d383"
"36","2.121614","fe80::b839:47ff:fe20:d383","ff02::fb","MDNS","107","Standard query 0x0000 PTR _ipps._tcp.local, ""QM"" question PTR _ipp._tcp.local, ""QM"" question"
"37","2.458627","fe80::882f:b9ff:fe1b:941","ff02::fb","MDNS","107","Standard query 0x0000 PTR _ipps._tcp.local, ""QM"" question PTR _ipp._tcp.local, ""QM"" question"
"38","2.488399","0.0.0.0","255.255.255.255","DHCP","342","DHCP Discover - Transaction ID 0x533bd678"
"39","2.489042","HewlettP_5c:4d:bc","Broadcast","ARP","42","Who has 130.166.120.71? Tell 130.166.120.228"
"40","2.648246","0.0.0.0","255.255.255.255","DHCP","342","DHCP Discover - Transaction ID 0x2e2a3229"
"41","2.648967","HewlettP_5c:4d:bc","Broadcast","ARP","42","Who has 130.166.120.72? Tell 130.166.120.228"
"42","3.034460","fe80::b839:47ff:fe20:d383","ff02::fb","MDNS","203","Standard query response 0x0000 PTR, cache flush u20d-mate.local AAAA, cache flush fe80::b839:47ff:fe20:d383"
"43","3.324126","fe80::882f:b9ff:fe1b:941","ff02::2","ICMPv6","70","Router Solicitation from 02:4f:33:d2:25:6c"
"44","3.394888","fe80::882f:b9ff:fe1b:941","ff02::fb","MDNS","203","Standard query response 0x0000 PTR, cache flush u20d-mate.local AAAA, cache flush fe80::882f:b9ff:fe1b:941"
"45","3.490555","0.0.0.0","255.255.255.255","DHCP","342","DHCP Request  - Transaction ID 0x533bd678"
"46","3.520172","HewlettP_5c:4d:bc","Broadcast","ARP","42","Who has 130.166.120.71? Tell 130.166.120.228"
"47","3.679604","HewlettP_5c:4d:bc","Broadcast","ARP","42","Who has 130.166.120.72? Tell 130.166.120.228"
"48","3.679877","130.166.120.228","130.166.120.72","DHCP","342","DHCP Offer    - Transaction ID 0x2e2a3229"
"49","3.680495","0.0.0.0","255.255.255.255","DHCP","342","DHCP Request  - Transaction ID 0x2e2a3229"
"50","3.683322","130.166.120.228","130.166.120.72","DHCP","342","DHCP ACK      - Transaction ID 0x2e2a3229"
"51","4.122496","fe80::b839:47ff:fe20:d383","ff02::fb","MDNS","107","Standard query 0x0000 PTR _ipps._tcp.local, ""QM"" question PTR _ipp._tcp.local, ""QM"" question"
"52","4.604026","fe80::7a3a:84ff:fe9c:e714","ff02::2","ICMPv6","70","Router Solicitation from 78:3a:84:9c:e7:14"
"53","4.604099","fe80::1298:36ff:feaf:ef9a","ff02::2","ICMPv6","70","Router Solicitation from 10:98:36:af:ef:9a"
"54","4.604136","fe80::219:bbff:fe9b:59b","ff02::2","ICMPv6","70","Router Solicitation from 00:19:bb:9b:05:9b"
"55","4.700129","HewlettP_5c:4d:bc","Broadcast","ARP","42","Who has 130.166.120.72? Tell 130.166.120.228"
"56","4.700186","Apple_9c:e7:14","HewlettP_5c:4d:bc","ARP","42","130.166.120.72 is at 78:3a:84:9c:e7:14"
"57","4.700216","130.166.120.228","130.166.120.72","ICMP","62","Echo (ping) request  id=0xd047, seq=0/0, ttl=64 (reply in 58)"
"58","4.700245","130.166.120.72","130.166.120.228","ICMP","62","Echo (ping) reply    id=0xd047, seq=0/0, ttl=64 (request in 57)"
"59","4.860188","fe80::230:6eff:fe5c:4dbc","ff02::2","ICMPv6","70","Router Solicitation from 00:30:6e:5c:4d:bc"
"60","5.116220","fe80::5ed2:e4ff:fe58:12fc","ff02::2","ICMPv6","70","Router Solicitation from 5c:d2:e4:58:12:fc"
"61","5.181823","fe80::b839:47ff:fe20:d383","ff02::fb","MDNS","203","Standard query response 0x0000 PTR, cache flush u20d-mate.local AAAA, cache flush fe80::b839:47ff:fe20:d383"
"62","5.372104","fe80::b839:47ff:fe20:d383","ff02::2","ICMPv6","70","Router Solicitation from ba:39:47:20:d3:83"
"63","6.458905","fe80::882f:b9ff:fe1b:941","ff02::fb","MDNS","107","Standard query 0x0000 PTR _ipps._tcp.local, ""QM"" question PTR _ipp._tcp.local, ""QM"" question"
"64","8.126621","fe80::b839:47ff:fe20:d383","ff02::fb","MDNS","107","Standard query 0x0000 PTR _ipps._tcp.local, ""QM"" question PTR _ipp._tcp.local, ""QM"" question"
"65","9.724409","Apple_9c:e7:14","HewlettP_5c:4d:bc","ARP","42","Who has 130.166.120.228? Tell 130.166.120.72"
"66","9.724605","HewlettP_5c:4d:bc","Apple_9c:e7:14","ARP","42","130.166.120.228 is at 00:30:6e:5c:4d:bc"
"67","11.260222","fe80::882f:b9ff:fe1b:941","ff02::2","ICMPv6","70","Router Solicitation from 02:4f:33:d2:25:6c"
"68","11.772157","fe80::7a3a:84ff:fe9c:e714","ff02::2","ICMPv6","70","Router Solicitation from 78:3a:84:9c:e7:14"
"69","11.772169","fe80::219:bbff:fe9b:59b","ff02::2","ICMPv6","70","Router Solicitation from 00:19:bb:9b:05:9b"
"70","12.797202","fe80::1298:36ff:feaf:ef9a","ff02::2","ICMPv6","70","Router Solicitation from 10:98:36:af:ef:9a"
"71","13.052238","fe80::5ed2:e4ff:fe58:12fc","ff02::2","ICMPv6","70","Router Solicitation from 5c:d2:e4:58:12:fc"
"72","13.052273","fe80::230:6eff:fe5c:4dbc","ff02::2","ICMPv6","70","Router Solicitation from 00:30:6e:5c:4d:bc"
"73","13.820085","fe80::b839:47ff:fe20:d383","ff02::2","ICMPv6","70","Router Solicitation from ba:39:47:20:d3:83"
"74","14.459753","fe80::882f:b9ff:fe1b:941","ff02::fb","MDNS","107","Standard query 0x0000 PTR _ipps._tcp.local, ""QM"" question PTR _ipp._tcp.local, ""QM"" question"
"75","16.123073","fe80::b839:47ff:fe20:d383","ff02::fb","MDNS","107","Standard query 0x0000 PTR _ipps._tcp.local, ""QM"" question PTR _ipp._tcp.local, ""QM"" question"
"76","25.852830","fe80::7a3a:84ff:fe9c:e714","ff02::2","ICMPv6","70","Router Solicitation from 78:3a:84:9c:e7:14"
"77","26.364214","fe80::219:bbff:fe9b:59b","ff02::2","ICMPv6","70","Router Solicitation from 00:19:bb:9b:05:9b"
"78","27.133121","fe80::882f:b9ff:fe1b:941","ff02::2","ICMPv6","70","Router Solicitation from 02:4f:33:d2:25:6c"
"79","27.900776","fe80::5ed2:e4ff:fe58:12fc","ff02::2","ICMPv6","70","Router Solicitation from 5c:d2:e4:58:12:fc"
"80","28.668052","fe80::230:6eff:fe5c:4dbc","ff02::2","ICMPv6","70","Router Solicitation from 00:30:6e:5c:4d:bc"
"81","30.204184","fe80::1298:36ff:feaf:ef9a","ff02::2","ICMPv6","70","Router Solicitation from 10:98:36:af:ef:9a"
"82","30.460188","fe80::882f:b9ff:fe1b:941","ff02::fb","MDNS","107","Standard query 0x0000 PTR _ipps._tcp.local, ""QM"" question PTR _ipp._tcp.local, ""QM"" question"
"83","32.127669","fe80::b839:47ff:fe20:d383","ff02::fb","MDNS","107","Standard query 0x0000 PTR _ipps._tcp.local, ""QM"" question PTR _ipp._tcp.local, ""QM"" question"
"84","32.252134","fe80::b839:47ff:fe20:d383","ff02::2","ICMPv6","70","Router Solicitation from ba:39:47:20:d3:83"
"85","44.926528","Apple_9c:e7:14","Broadcast","ARP","42","Who has 130.166.120.243? Tell 130.166.120.72"
"86","44.926601","Cisco_37:44:cf","Apple_9c:e7:14","ARP","42","130.166.120.243 is at 00:06:d7:37:44:cf"
"87","44.926604","130.166.120.72","70.184.98.27","DNS","72","Standard query 0x532a A mail.juno.io"
"88","44.926654","130.166.120.72","70.184.98.27","DNS","72","Standard query 0xfd2c AAAA mail.juno.io"
"89","44.927192","70.184.98.27","130.166.120.72","DNS","88","Standard query response 0x532a A mail.juno.io A 70.184.98.141"
"90","44.927614","70.184.98.27","130.166.120.72","DNS","116","Standard query response 0xfd2c AAAA mail.juno.io SOA ns.juno.io"
"91","44.928046","130.166.120.72","70.184.98.141","TCP","74","56834  >  25 [SYN] Seq=0 Win=64240 Len=0 MSS=1460 SACK_PERM TSval=2158430131 TSecr=0 WS=128"
"92","44.928138","70.184.98.141","130.166.120.72","TCP","74","25  >  56834 [SYN, ACK] Seq=0 Ack=1 Win=65160 Len=0 MSS=1460 SACK_PERM TSval=2980685597 TSecr=2158430131 WS=128"
"93","44.928151","130.166.120.72","70.184.98.141","TCP","66","56834  >  25 [ACK] Seq=1 Ack=1 Win=64256 Len=0 TSval=2158430131 TSecr=2980685597"
"94","44.943336","70.184.98.141","130.166.120.72","SMTP","118","S: 220 mail.juno.io ESMTP server (Dr Sep says hello!)"
"95","44.943411","130.166.120.72","70.184.98.141","TCP","66","56834  >  25 [ACK] Seq=1 Ack=53 Win=64256 Len=0 TSval=2158430146 TSecr=2980685612"
"96","44.943569","130.166.120.72","70.184.98.141","SMTP","79","C: EHLO apollo"
"97","44.943650","70.184.98.141","130.166.120.72","TCP","66","25  >  56834 [ACK] Seq=53 Ack=14 Win=65280 Len=0 TSval=2980685612 TSecr=2158430146"
"98","44.943830","70.184.98.141","130.166.120.72","SMTP","207","S: 250-mail | PIPELINING | SIZE 10240000 | VRFY | ETRN | ENHANCEDSTATUSCODES | 8BITMIME | DSN | SMTPUTF8 | CHUNKING"
"99","44.943841","130.166.120.72","70.184.98.141","TCP","66","56834  >  25 [ACK] Seq=14 Ack=194 Win=64128 Len=0 TSval=2158430146 TSecr=2980685612"
"100","44.944170","130.166.120.72","70.184.98.141","SMTP","103","C: MAIL FROM:<sepehr@juno.io> SIZE=457"
"101","44.944253","70.184.98.141","130.166.120.72","TCP","66","25  >  56834 [ACK] Seq=194 Ack=51 Win=65280 Len=0 TSval=2980685613 TSecr=2158430147"
"102","44.953776","70.184.98.141","130.166.120.72","SMTP","80","S: 250 2.1.0 Ok"
"103","44.953793","130.166.120.72","70.184.98.141","TCP","66","56834  >  25 [ACK] Seq=51 Ack=208 Win=64128 Len=0 TSval=2158430156 TSecr=2980685622"
"104","44.953940","130.166.120.72","70.184.98.141","SMTP","100","C: RCPT TO:<nestor_everett@juno.io>"
"105","44.954005","70.184.98.141","130.166.120.72","TCP","66","25  >  56834 [ACK] Seq=208 Ack=85 Win=65280 Len=0 TSval=2980685623 TSecr=2158430157"
"106","44.964631","70.184.98.141","130.166.120.72","SMTP","80","S: 250 2.1.5 Ok"
"107","44.964649","130.166.120.72","70.184.98.141","TCP","66","56834  >  25 [ACK] Seq=85 Ack=222 Win=64128 Len=0 TSval=2158430167 TSecr=2980685633"
"108","44.964801","130.166.120.72","70.184.98.141","SMTP","72","C: DATA"
"109","44.964874","70.184.98.141","130.166.120.72","TCP","66","25  >  56834 [ACK] Seq=222 Ack=91 Win=65280 Len=0 TSval=2980685633 TSecr=2158430167"
"110","44.965004","70.184.98.141","130.166.120.72","SMTP","103","S: 354 End data with <CR><LF>.<CR><LF>"
"111","44.966139","130.166.120.72","70.184.98.141","SMTP","523","C: DATA fragment, 457 bytes"
"112","44.966267","70.184.98.141","130.166.120.72","TCP","66","25  >  56834 [ACK] Seq=259 Ack=548 Win=64896 Len=0 TSval=2980685635 TSecr=2158430169"
"113","44.966309","130.166.120.72","70.184.98.141","SMTP/IMF","69",""
"114","44.966373","70.184.98.141","130.166.120.72","TCP","66","25  >  56834 [ACK] Seq=259 Ack=551 Win=64896 Len=0 TSval=2980685635 TSecr=2158430169"
"115","44.976610","70.184.98.141","130.166.120.72","SMTP","103","S: 250 2.0.0 Ok: queued as 0E9D5AE01A2"
"116","44.977075","130.166.120.72","70.184.98.141","SMTP","72","C: QUIT"
"117","44.977204","70.184.98.141","130.166.120.72","TCP","66","25  >  56834 [ACK] Seq=296 Ack=557 Win=64896 Len=0 TSval=2980685646 TSecr=2158430180"
"118","44.977439","70.184.98.141","130.166.120.72","SMTP","81","S: 221 2.0.0 Bye"
"119","44.977508","70.184.98.141","130.166.120.72","TCP","66","25  >  56834 [FIN, ACK] Seq=311 Ack=557 Win=64896 Len=0 TSval=2980685646 TSecr=2158430180"
"120","44.977537","130.166.120.72","70.184.98.141","TCP","66","56834  >  25 [FIN, ACK] Seq=557 Ack=312 Win=64128 Len=0 TSval=2158430180 TSecr=2980685646"
"121","44.977594","70.184.98.141","130.166.120.72","TCP","66","25  >  56834 [ACK] Seq=312 Ack=558 Win=64896 Len=0 TSval=2980685646 TSecr=2158430180"
"122","46.002496","130.166.120.72","70.184.98.27","DNS","72","Standard query 0xafea A zeus.juno.io"
"123","46.002668","130.166.120.72","70.184.98.27","DNS","72","Standard query 0x1c1e AAAA zeus.juno.io"
"124","46.003373","70.184.98.27","130.166.120.72","DNS","100","Standard query response 0xafea A zeus.juno.io A 130.166.120.71"
"125","46.003846","70.184.98.27","130.166.120.72","DNS","116","Standard query response 0x1c1e AAAA zeus.juno.io SOA ns.juno.io"
"126","46.004261","Apple_9c:e7:14","Broadcast","ARP","42","Who has 130.166.120.71? Tell 130.166.120.72"
"127","46.004366","IntelCor_58:12:fc","Apple_9c:e7:14","ARP","42","130.166.120.71 is at 5c:d2:e4:58:12:fc"
"128","46.004370","130.166.120.72","130.166.120.71","ICMP","98","Echo (ping) request  id=0x0070, seq=1/256, ttl=64 (reply in 129)"
"129","46.004391","130.166.120.71","130.166.120.72","ICMP","98","Echo (ping) reply    id=0x0070, seq=1/256, ttl=64 (request in 128)"
"130","46.004515","130.166.120.72","70.184.98.27","DNS","87","Standard query 0xafaf PTR 71.120.166.130.in-addr.arpa"
"131","50.172118","Cisco_37:44:cf","Apple_9c:e7:14","ARP","42","Who has 130.166.120.72? Tell 130.166.120.243"
"132","50.172145","Apple_9c:e7:14","Cisco_37:44:cf","ARP","42","130.166.120.72 is at 78:3a:84:9c:e7:14"
"133","51.010148","130.166.120.72","70.184.98.27","DNS","87","Standard query 0xafaf PTR 71.120.166.130.in-addr.arpa"
"134","51.196223","IntelCor_58:12:fc","Apple_9c:e7:14","ARP","42","Who has 130.166.120.72? Tell 130.166.120.71"
"135","51.196328","Apple_9c:e7:14","IntelCor_58:12:fc","ARP","42","130.166.120.72 is at 78:3a:84:9c:e7:14"
"136","54.780070","fe80::7a3a:84ff:fe9c:e714","ff02::2","ICMPv6","70","Router Solicitation from 78:3a:84:9c:e7:14"
"137","56.002765","70.184.98.27","130.166.120.72","DNS","87","Standard query response 0xafaf Server failure PTR 71.120.166.130.in-addr.arpa"
"138","56.003218","130.166.120.72","130.166.120.71","ICMP","98","Echo (ping) request  id=0x0070, seq=2/512, ttl=64 (reply in 139)"
"139","56.003302","130.166.120.71","130.166.120.72","ICMP","98","Echo (ping) reply    id=0x0070, seq=2/512, ttl=64 (request in 138)"
"140","56.828264","fe80::219:bbff:fe9b:59b","ff02::2","ICMPv6","70","Router Solicitation from 00:19:bb:9b:05:9b"
"141","57.020264","130.166.120.72","130.166.120.71","ICMP","98","Echo (ping) request  id=0x0070, seq=3/768, ttl=64 (reply in 142)"
"142","57.020340","130.166.120.71","130.166.120.72","ICMP","98","Echo (ping) reply    id=0x0070, seq=3/768, ttl=64 (request in 141)"
"143","58.044179","130.166.120.72","130.166.120.71","ICMP","98","Echo (ping) request  id=0x0070, seq=4/1024, ttl=64 (reply in 144)"
"144","58.044256","130.166.120.71","130.166.120.72","ICMP","98","Echo (ping) reply    id=0x0070, seq=4/1024, ttl=64 (request in 143)"
"145","58.877003","fe80::882f:b9ff:fe1b:941","ff02::2","ICMPv6","70","Router Solicitation from 02:4f:33:d2:25:6c"
"146","58.877185","fe80::5ed2:e4ff:fe58:12fc","ff02::2","ICMPv6","70","Router Solicitation from 5c:d2:e4:58:12:fc"
"147","59.068219","130.166.120.72","130.166.120.71","ICMP","98","Echo (ping) request  id=0x0070, seq=5/1280, ttl=64 (reply in 148)"
"148","59.068293","130.166.120.71","130.166.120.72","ICMP","98","Echo (ping) reply    id=0x0070, seq=5/1280, ttl=64 (request in 147)"
"149","60.093105","130.166.120.72","70.184.98.27","DNS","71","Standard query 0xf6a4 A www.juno.io"
"150","60.093215","130.166.120.72","70.184.98.27","DNS","71","Standard query 0xcaad AAAA www.juno.io"
"151","60.093554","70.184.98.27","130.166.120.72","DNS","87","Standard query response 0xf6a4 A www.juno.io A 70.184.98.60"
"152","60.093715","70.184.98.27","130.166.120.72","DNS","115","Standard query response 0xcaad AAAA www.juno.io SOA ns.juno.io"
"153","60.093861","130.166.120.72","70.184.98.60","TCP","74","42302  >  80 [SYN] Seq=0 Win=64240 Len=0 MSS=1460 SACK_PERM TSval=686028353 TSecr=0 WS=128"
"154","60.093964","70.184.98.60","130.166.120.72","TCP","74","80  >  42302 [SYN, ACK] Seq=0 Ack=1 Win=65160 Len=0 MSS=1460 SACK_PERM TSval=2894760178 TSecr=686028353 WS=128"
"155","60.093979","130.166.120.72","70.184.98.60","TCP","66","42302  >  80 [ACK] Seq=1 Ack=1 Win=64256 Len=0 TSval=686028354 TSecr=2894760178"
"156","60.094064","130.166.120.72","70.184.98.60","TCP","204","42302  >  80 [PSH, ACK] Seq=1 Ack=1 Win=64256 Len=138 TSval=686028354 TSecr=2894760178"
"157","60.094149","70.184.98.60","130.166.120.72","TCP","66","80  >  42302 [ACK] Seq=1 Ack=139 Win=65024 Len=0 TSval=2894760178 TSecr=686028354"
"158","60.094687","70.184.98.60","130.166.120.72","TCP","593","80  >  42302 [PSH, ACK] Seq=1 Ack=139 Win=65024 Len=527 TSval=2894760178 TSecr=686028354"
"159","60.094700","130.166.120.72","70.184.98.60","TCP","66","42302  >  80 [ACK] Seq=139 Ack=528 Win=64128 Len=0 TSval=686028354 TSecr=2894760178"
"160","60.096057","130.166.120.72","70.184.98.60","TCP","214","42302  >  80 [PSH, ACK] Seq=139 Ack=528 Win=64128 Len=148 TSval=686028356 TSecr=2894760178"
"161","60.096183","70.184.98.60","130.166.120.72","TCP","66","80  >  42302 [ACK] Seq=528 Ack=287 Win=64896 Len=0 TSval=2894760180 TSecr=686028356"
"162","60.096428","70.184.98.60","130.166.120.72","TCP","555","80  >  42302 [PSH, ACK] Seq=528 Ack=287 Win=64896 Len=489 TSval=2894760180 TSecr=686028356"
"163","60.096437","130.166.120.72","70.184.98.60","TCP","66","42302  >  80 [ACK] Seq=287 Ack=1017 Win=64128 Len=0 TSval=686028356 TSecr=2894760180"
"164","60.096723","130.166.120.72","70.184.98.60","TCP","242","42302  >  80 [PSH, ACK] Seq=287 Ack=1017 Win=64128 Len=176 TSval=686028356 TSecr=2894760180"
"165","60.096757","70.184.98.60","130.166.120.72","TCP","66","80  >  42302 [ACK] Seq=1017 Ack=463 Win=64768 Len=0 TSval=2894760180 TSecr=686028356"
"166","60.097076","70.184.98.60","130.166.120.72","TCP","7306","80  >  42302 [PSH, ACK] Seq=1017 Ack=463 Win=64768 Len=7240 TSval=2894760181 TSecr=686028356"
"167","60.097133","130.166.120.72","70.184.98.60","TCP","66","42302  >  80 [ACK] Seq=463 Ack=8257 Win=61312 Len=0 TSval=686028357 TSecr=2894760181"
"168","60.097195","70.184.98.60","130.166.120.72","TCP","7306","80  >  42302 [PSH, ACK] Seq=8257 Ack=463 Win=64768 Len=7240 TSval=2894760181 TSecr=686028356"
"169","60.097203","130.166.120.72","70.184.98.60","TCP","66","42302  >  80 [ACK] Seq=463 Ack=15497 Win=57728 Len=0 TSval=686028357 TSecr=2894760181"
"170","60.097294","70.184.98.60","130.166.120.72","TCP","14546","80  >  42302 [PSH, ACK] Seq=15497 Ack=463 Win=64768 Len=14480 TSval=2894760181 TSecr=686028357"
"171","60.097304","130.166.120.72","70.184.98.60","TCP","66","42302  >  80 [ACK] Seq=463 Ack=29977 Win=50432 Len=0 TSval=686028357 TSecr=2894760181"
"172","60.097339","70.184.98.60","130.166.120.72","TCP","14546","80  >  42302 [PSH, ACK] Seq=29977 Ack=463 Win=64768 Len=14480 TSval=2894760181 TSecr=686028357"
"173","60.097348","130.166.120.72","70.184.98.60","TCP","66","42302  >  80 [ACK] Seq=463 Ack=44457 Win=43264 Len=0 TSval=686028357 TSecr=2894760181"
"174","60.097391","70.184.98.60","130.166.120.72","TCP","2962","80  >  42302 [PSH, ACK] Seq=44457 Ack=463 Win=64768 Len=2896 TSval=2894760181 TSecr=686028357"
"175","60.097398","130.166.120.72","70.184.98.60","TCP","66","42302  >  80 [ACK] Seq=463 Ack=47353 Win=41728 Len=0 TSval=686028357 TSecr=2894760181"
"176","60.097439","70.184.98.60","130.166.120.72","TCP","29026","80  >  42302 [PSH, ACK] Seq=47353 Ack=463 Win=64768 Len=28960 TSval=2894760181 TSecr=686028357"
"177","60.097461","130.166.120.72","70.184.98.60","TCP","66","42302  >  80 [ACK] Seq=463 Ack=76313 Win=50432 Len=0 TSval=686028357 TSecr=2894760181"
"178","60.097499","70.184.98.60","130.166.120.72","TCP","2962","80  >  42302 [PSH, ACK] Seq=76313 Ack=463 Win=64768 Len=2896 TSval=2894760181 TSecr=686028357"
"179","60.097506","130.166.120.72","70.184.98.60","TCP","66","42302  >  80 [ACK] Seq=463 Ack=79209 Win=49024 Len=0 TSval=686028357 TSecr=2894760181"
"180","60.097543","70.184.98.60","130.166.120.72","TCP","8578","80  >  42302 [PSH, ACK] Seq=79209 Ack=463 Win=64768 Len=8512 TSval=2894760181 TSecr=686028357"
"181","60.097558","130.166.120.72","70.184.98.60","TCP","66","42302  >  80 [ACK] Seq=463 Ack=87721 Win=40576 Len=0 TSval=686028357 TSecr=2894760181"
"182","60.097581","70.184.98.60","130.166.120.72","TCP","23410","80  >  42302 [PSH, ACK] Seq=87721 Ack=463 Win=64768 Len=23344 TSval=2894760181 TSecr=686028357"
"183","60.097592","130.166.120.72","70.184.98.60","TCP","66","42302  >  80 [ACK] Seq=463 Ack=111065 Win=33152 Len=0 TSval=686028357 TSecr=2894760181"
"184","60.097666","70.184.98.60","130.166.120.72","TCP","31922","80  >  42302 [PSH, ACK] Seq=111065 Ack=463 Win=64768 Len=31856 TSval=2894760181 TSecr=686028357"
"185","60.097682","130.166.120.72","70.184.98.60","TCP","66","42302  >  80 [ACK] Seq=463 Ack=142921 Win=64128 Len=0 TSval=686028357 TSecr=2894760181"
"186","60.097856","70.184.98.60","130.166.120.72","TCP","31922","80  >  42302 [PSH, ACK] Seq=142921 Ack=463 Win=64768 Len=31856 TSval=2894760181 TSecr=686028357"
"187","60.097867","130.166.120.72","70.184.98.60","TCP","66","42302  >  80 [ACK] Seq=463 Ack=174777 Win=127872 Len=0 TSval=686028357 TSecr=2894760181"
"188","60.097887","70.184.98.60","130.166.120.72","TCP","31922","80  >  42302 [PSH, ACK] Seq=174777 Ack=463 Win=64768 Len=31856 TSval=2894760181 TSecr=686028357"
"189","60.097897","130.166.120.72","70.184.98.60","TCP","66","42302  >  80 [ACK] Seq=463 Ack=206633 Win=191616 Len=0 TSval=686028358 TSecr=2894760181"
"190","60.097945","70.184.98.60","130.166.120.72","TCP","31922","80  >  42302 [PSH, ACK] Seq=206633 Ack=463 Win=64768 Len=31856 TSval=2894760182 TSecr=686028357"
"191","60.097957","130.166.120.72","70.184.98.60","TCP","66","42302  >  80 [ACK] Seq=463 Ack=238489 Win=255232 Len=0 TSval=686028358 TSecr=2894760182"
"192","60.098074","70.184.98.60","130.166.120.72","TCP","31922","80  >  42302 [PSH, ACK] Seq=238489 Ack=463 Win=64768 Len=31856 TSval=2894760182 TSecr=686028357"
"193","60.098115","130.166.120.72","70.184.98.60","TCP","66","42302  >  80 [ACK] Seq=463 Ack=270345 Win=318976 Len=0 TSval=686028358 TSecr=2894760182"
"194","60.098169","70.184.98.60","130.166.120.72","TCP","31922","80  >  42302 [PSH, ACK] Seq=270345 Ack=463 Win=64768 Len=31856 TSval=2894760182 TSecr=686028358"
"195","60.098182","130.166.120.72","70.184.98.60","TCP","66","42302  >  80 [ACK] Seq=463 Ack=302201 Win=382720 Len=0 TSval=686028358 TSecr=2894760182"
"196","60.098229","70.184.98.60","130.166.120.72","TCP","31922","80  >  42302 [PSH, ACK] Seq=302201 Ack=463 Win=64768 Len=31856 TSval=2894760182 TSecr=686028358"
"197","60.098242","130.166.120.72","70.184.98.60","TCP","66","42302  >  80 [ACK] Seq=463 Ack=334057 Win=446464 Len=0 TSval=686028358 TSecr=2894760182"
"198","60.098288","70.184.98.60","130.166.120.72","TCP","31922","80  >  42302 [PSH, ACK] Seq=334057 Ack=463 Win=64768 Len=31856 TSval=2894760182 TSecr=686028358"
"199","60.098314","130.166.120.72","70.184.98.60","TCP","66","42302  >  80 [ACK] Seq=463 Ack=365913 Win=510080 Len=0 TSval=686028358 TSecr=2894760182"
"200","60.098363","70.184.98.60","130.166.120.72","TCP","31922","80  >  42302 [PSH, ACK] Seq=365913 Ack=463 Win=64768 Len=31856 TSval=2894760182 TSecr=686028358"
"201","60.098377","130.166.120.72","70.184.98.60","TCP","66","42302  >  80 [ACK] Seq=463 Ack=397769 Win=573824 Len=0 TSval=686028358 TSecr=2894760182"
"202","60.098429","70.184.98.60","130.166.120.72","TCP","31922","80  >  42302 [PSH, ACK] Seq=397769 Ack=463 Win=64768 Len=31856 TSval=2894760182 TSecr=686028358"
"203","60.098457","130.166.120.72","70.184.98.60","TCP","66","42302  >  80 [ACK] Seq=463 Ack=429625 Win=637568 Len=0 TSval=686028358 TSecr=2894760182"
"204","60.098495","70.184.98.60","130.166.120.72","TCP","2962","80  >  42302 [PSH, ACK] Seq=429625 Ack=463 Win=64768 Len=2896 TSval=2894760182 TSecr=686028358"
"205","60.098503","130.166.120.72","70.184.98.60","TCP","66","42302  >  80 [ACK] Seq=463 Ack=432521 Win=643328 Len=0 TSval=686028358 TSecr=2894760182"
"206","60.098554","70.184.98.60","130.166.120.72","TCP","29026","80  >  42302 [PSH, ACK] Seq=432521 Ack=463 Win=64768 Len=28960 TSval=2894760182 TSecr=686028358"
"207","60.098566","130.166.120.72","70.184.98.60","TCP","66","42302  >  80 [ACK] Seq=463 Ack=461481 Win=701312 Len=0 TSval=686028358 TSecr=2894760182"
"208","60.098687","70.184.98.60","130.166.120.72","TCP","65226","80  >  42302 [PSH, ACK] Seq=461481 Ack=463 Win=64768 Len=65160 TSval=2894760182 TSecr=686028358"
"209","60.098706","130.166.120.72","70.184.98.60","TCP","66","42302  >  80 [ACK] Seq=463 Ack=526641 Win=831616 Len=0 TSval=686028358 TSecr=2894760182"
"210","60.098788","70.184.98.60","130.166.120.72","TCP","65226","80  >  42302 [PSH, ACK] Seq=526641 Ack=463 Win=64768 Len=65160 TSval=2894760182 TSecr=686028358"
"211","60.098804","130.166.120.72","70.184.98.60","TCP","66","42302  >  80 [ACK] Seq=463 Ack=591801 Win=961920 Len=0 TSval=686028358 TSecr=2894760182"
"212","60.098879","70.184.98.60","130.166.120.72","TCP","5858","80  >  42302 [PSH, ACK] Seq=591801 Ack=463 Win=64768 Len=5792 TSval=2894760182 TSecr=686028358"
"213","60.098889","130.166.120.72","70.184.98.60","TCP","66","42302  >  80 [ACK] Seq=463 Ack=597593 Win=973440 Len=0 TSval=686028358 TSecr=2894760182"
"214","60.099067","70.184.98.60","130.166.120.72","TCP","65226","80  >  42302 [PSH, ACK] Seq=597593 Ack=463 Win=64768 Len=65160 TSval=2894760183 TSecr=686028358"
"215","60.099083","130.166.120.72","70.184.98.60","TCP","66","42302  >  80 [ACK] Seq=463 Ack=662753 Win=1103872 Len=0 TSval=686028359 TSecr=2894760183"
"216","60.099153","70.184.98.60","130.166.120.72","TCP","65226","80  >  42302 [PSH, ACK] Seq=662753 Ack=463 Win=64768 Len=65160 TSval=2894760183 TSecr=686028358"
"217","60.099175","130.166.120.72","70.184.98.60","TCP","66","42302  >  80 [ACK] Seq=463 Ack=727913 Win=1234176 Len=0 TSval=686028359 TSecr=2894760183"
"218","60.099219","70.184.98.60","130.166.120.72","TCP","13098","80  >  42302 [PSH, ACK] Seq=727913 Ack=463 Win=64768 Len=13032 TSval=2894760183 TSecr=686028358"
"219","60.099229","130.166.120.72","70.184.98.60","TCP","66","42302  >  80 [ACK] Seq=463 Ack=740945 Win=1260160 Len=0 TSval=686028359 TSecr=2894760183"
"220","60.099289","70.184.98.60","130.166.120.72","TCP","52194","80  >  42302 [PSH, ACK] Seq=740945 Ack=463 Win=64768 Len=52128 TSval=2894760183 TSecr=686028359"
"221","60.099305","130.166.120.72","70.184.98.60","TCP","66","42302  >  80 [ACK] Seq=463 Ack=793073 Win=1364480 Len=0 TSval=686028359 TSecr=2894760183"
"222","60.099359","70.184.98.60","130.166.120.72","TCP","65226","80  >  42302 [PSH, ACK] Seq=793073 Ack=463 Win=64768 Len=65160 TSval=2894760183 TSecr=686028359"
"223","60.099376","130.166.120.72","70.184.98.60","TCP","66","42302  >  80 [ACK] Seq=463 Ack=858233 Win=1494784 Len=0 TSval=686028359 TSecr=2894760183"
"224","60.099436","70.184.98.60","130.166.120.72","TCP","33370","80  >  42302 [PSH, ACK] Seq=858233 Ack=463 Win=64768 Len=33304 TSval=2894760183 TSecr=686028359"
"225","60.099451","130.166.120.72","70.184.98.60","TCP","66","42302  >  80 [ACK] Seq=463 Ack=891537 Win=1561344 Len=0 TSval=686028359 TSecr=2894760183"
"226","60.099485","70.184.98.60","130.166.120.72","TCP","31922","80  >  42302 [PSH, ACK] Seq=891537 Ack=463 Win=64768 Len=31856 TSval=2894760183 TSecr=686028359"
"227","60.099500","130.166.120.72","70.184.98.60","TCP","66","42302  >  80 [ACK] Seq=463 Ack=923393 Win=1625088 Len=0 TSval=686028359 TSecr=2894760183"
"228","60.099556","70.184.98.60","130.166.120.72","TCP","65226","80  >  42302 [PSH, ACK] Seq=923393 Ack=463 Win=64768 Len=65160 TSval=2894760183 TSecr=686028359"
"229","60.099574","130.166.120.72","70.184.98.60","TCP","66","42302  >  80 [ACK] Seq=463 Ack=988553 Win=1755392 Len=0 TSval=686028359 TSecr=2894760183"
"230","60.099634","70.184.98.60","130.166.120.72","TCP","65226","80  >  42302 [PSH, ACK] Seq=988553 Ack=463 Win=64768 Len=65160 TSval=2894760183 TSecr=686028359"
"231","60.099651","130.166.120.72","70.184.98.60","TCP","66","42302  >  80 [ACK] Seq=463 Ack=1053713 Win=1845888 Len=0 TSval=686028359 TSecr=2894760183"
"232","60.099764","70.184.98.60","130.166.120.72","TCP","65226","80  >  42302 [PSH, ACK] Seq=1053713 Ack=463 Win=64768 Len=65160 TSval=2894760183 TSecr=686028359"
"233","60.099790","130.166.120.72","70.184.98.60","TCP","66","42302  >  80 [ACK] Seq=463 Ack=1118873 Win=1813376 Len=0 TSval=686028359 TSecr=2894760183"
"234","60.100124","70.184.98.60","130.166.120.72","TCP","65226","80  >  42302 [PSH, ACK] Seq=1118873 Ack=463 Win=64768 Len=65160 TSval=2894760183 TSecr=686028359"
"235","60.100150","130.166.120.72","70.184.98.60","TCP","66","42302  >  80 [ACK] Seq=463 Ack=1184033 Win=1909632 Len=0 TSval=686028360 TSecr=2894760183"
"236","60.100322","70.184.98.60","130.166.120.72","TCP","33370","80  >  42302 [PSH, ACK] Seq=1184033 Ack=463 Win=64768 Len=33304 TSval=2894760184 TSecr=686028359"
"237","60.100373","130.166.120.72","70.184.98.60","TCP","66","42302  >  80 [ACK] Seq=463 Ack=1217337 Win=1892224 Len=0 TSval=686028360 TSecr=2894760184"
"238","60.100428","70.184.98.60","130.166.120.72","TCP","65226","80  >  42302 [PSH, ACK] Seq=1217337 Ack=463 Win=64768 Len=65160 TSval=2894760184 TSecr=686028359"
"239","60.100465","130.166.120.72","70.184.98.60","TCP","66","42302  >  80 [ACK] Seq=463 Ack=1282497 Win=1859712 Len=0 TSval=686028360 TSecr=2894760184"
"240","60.100472","70.184.98.60","130.166.120.72","TCP","10811","80  >  42302 [PSH, ACK] Seq=1282497 Ack=463 Win=64768 Len=10745 TSval=2894760184 TSecr=686028360"
"241","60.100528","130.166.120.72","70.184.98.60","TCP","66","42302  >  80 [ACK] Seq=463 Ack=1293242 Win=1854336 Len=0 TSval=686028360 TSecr=2894760184"
"242","60.102652","130.166.120.72","70.184.98.60","TCP","66","42302  >  80 [FIN, ACK] Seq=463 Ack=1293242 Win=1909632 Len=0 TSval=686028362 TSecr=2894760184"
"243","60.102652","70.184.98.60","130.166.120.72","TCP","66","80  >  42302 [FIN, ACK] Seq=1293242 Ack=464 Win=64768 Len=0 TSval=2894760186 TSecr=686028362"
"244","60.102652","130.166.120.72","70.184.98.60","TCP","66","42302  >  80 [ACK] Seq=464 Ack=1293243 Win=1909632 Len=0 TSval=686028362 TSecr=2894760186"
"245","61.134892","130.166.120.72","70.184.98.27","DNS","72","Standard query 0x059a A hera.juno.io"
"246","61.135038","130.166.120.72","70.184.98.27","DNS","72","Standard query 0xb297 AAAA hera.juno.io"
"247","61.136042","70.184.98.27","130.166.120.72","DNS","100","Standard query response 0x059a A hera.juno.io A 130.166.120.70"
"248","61.136586","70.184.98.27","130.166.120.72","DNS","116","Standard query response 0xb297 AAAA hera.juno.io SOA ns.juno.io"
"249","61.136871","Apple_9c:e7:14","Broadcast","ARP","42","Who has 130.166.120.70? Tell 130.166.120.72"
"250","61.136970","Dell_af:ef:9a","Apple_9c:e7:14","ARP","42","130.166.120.70 is at 10:98:36:af:ef:9a"
"251","61.136975","130.166.120.72","130.166.120.70","ICMP","98","Echo (ping) request  id=0x0072, seq=1/256, ttl=64 (reply in 252)"
"252","61.137002","130.166.120.70","130.166.120.72","ICMP","98","Echo (ping) reply    id=0x0072, seq=1/256, ttl=64 (request in 251)"
"253","61.137142","130.166.120.72","70.184.98.27","DNS","87","Standard query 0xa99e PTR 70.120.166.130.in-addr.arpa"
"254","62.461634","fe80::882f:b9ff:fe1b:941","ff02::fb","MDNS","107","Standard query 0x0000 PTR _ipps._tcp.local, ""QM"" question PTR _ipp._tcp.local, ""QM"" question"
"255","62.972187","fe80::230:6eff:fe5c:4dbc","ff02::2","ICMPv6","70","Router Solicitation from 00:30:6e:5c:4d:bc"
"256","64.129864","fe80::b839:47ff:fe20:d383","ff02::fb","MDNS","107","Standard query 0x0000 PTR _ipps._tcp.local, ""QM"" question PTR _ipp._tcp.local, ""QM"" question"
"257","65.020183","fe80::1298:36ff:feaf:ef9a","ff02::2","ICMPv6","70","Router Solicitation from 10:98:36:af:ef:9a"
"258","66.142401","130.166.120.72","70.184.98.27","DNS","87","Standard query 0xa99e PTR 70.120.166.130.in-addr.arpa"
"259","66.300064","Dell_af:ef:9a","Apple_9c:e7:14","ARP","42","Who has 130.166.120.72? Tell 130.166.120.70"
"260","66.300081","Apple_9c:e7:14","Dell_af:ef:9a","ARP","42","130.166.120.72 is at 78:3a:84:9c:e7:14"
"261","67.068089","fe80::b839:47ff:fe20:d383","ff02::2","ICMPv6","70","Router Solicitation from ba:39:47:20:d3:83"
"262","71.134674","70.184.98.27","130.166.120.72","DNS","87","Standard query response 0xa99e Server failure PTR 70.120.166.130.in-addr.arpa"
"263","71.135237","130.166.120.72","130.166.120.70","ICMP","98","Echo (ping) request  id=0x0072, seq=2/512, ttl=64 (reply in 264)"
"264","71.135307","130.166.120.70","130.166.120.72","ICMP","98","Echo (ping) reply    id=0x0072, seq=2/512, ttl=64 (request in 263)"
"265","72.157113","130.166.120.72","130.166.120.70","ICMP","98","Echo (ping) request  id=0x0072, seq=3/768, ttl=64 (reply in 266)"
"266","72.157194","130.166.120.70","130.166.120.72","ICMP","98","Echo (ping) reply    id=0x0072, seq=3/768, ttl=64 (request in 265)"
"267","73.181017","130.166.120.72","130.166.120.70","ICMP","98","Echo (ping) request  id=0x0072, seq=4/1024, ttl=64 (reply in 268)"
"268","73.181090","130.166.120.70","130.166.120.72","ICMP","98","Echo (ping) reply    id=0x0072, seq=4/1024, ttl=64 (request in 267)"
"269","74.205815","130.166.120.72","130.166.120.70","ICMP","98","Echo (ping) request  id=0x0072, seq=5/1280, ttl=64 (reply in 270)"
"270","74.206018","130.166.120.70","130.166.120.72","ICMP","98","Echo (ping) reply    id=0x0072, seq=5/1280, ttl=64 (request in 269)"
"271","75.229606","130.166.120.72","70.184.98.27","DNS","76","Standard query 0xe54f A intranet.juno.io"
"272","75.229722","130.166.120.72","70.184.98.27","DNS","76","Standard query 0x2375 AAAA intranet.juno.io"
"273","75.230007","70.184.98.27","130.166.120.72","DNS","92","Standard query response 0xe54f A intranet.juno.io A 130.166.120.11"
"274","75.230124","70.184.98.27","130.166.120.72","DNS","120","Standard query response 0x2375 AAAA intranet.juno.io SOA ns.juno.io"
"275","75.230321","Apple_9c:e7:14","Broadcast","ARP","42","Who has 130.166.120.11? Tell 130.166.120.72"
"276","75.230465","HewlettP_9b:05:9b","Apple_9c:e7:14","ARP","42","130.166.120.11 is at 00:19:bb:9b:05:9b"
"277","75.230472","130.166.120.72","130.166.120.11","TCP","74","52950  >  80 [SYN] Seq=0 Win=64240 Len=0 MSS=1460 SACK_PERM TSval=773073797 TSecr=0 WS=128"
"278","75.230516","130.166.120.11","130.166.120.72","TCP","74","80  >  52950 [SYN, ACK] Seq=0 Ack=1 Win=65160 Len=0 MSS=1460 SACK_PERM TSval=2816467214 TSecr=773073797 WS=128"
"279","75.230552","130.166.120.72","130.166.120.11","TCP","66","52950  >  80 [ACK] Seq=1 Ack=1 Win=64256 Len=0 TSval=773073797 TSecr=2816467214"
"280","75.230691","130.166.120.72","130.166.120.11","TCP","209","52950  >  80 [PSH, ACK] Seq=1 Ack=1 Win=64256 Len=143 TSval=773073797 TSecr=2816467214"
"281","75.230753","130.166.120.11","130.166.120.72","TCP","66","80  >  52950 [ACK] Seq=1 Ack=144 Win=65024 Len=0 TSval=2816467214 TSecr=773073797"
"282","75.231344","130.166.120.11","130.166.120.72","TCP","561","80  >  52950 [PSH, ACK] Seq=1 Ack=144 Win=65024 Len=495 TSval=2816467215 TSecr=773073797"
"283","75.231360","130.166.120.72","130.166.120.11","TCP","66","52950  >  80 [ACK] Seq=144 Ack=496 Win=64128 Len=0 TSval=773073798 TSecr=2816467215"
"284","75.232807","130.166.120.72","130.166.120.11","TCP","219","52950  >  80 [PSH, ACK] Seq=144 Ack=496 Win=64128 Len=153 TSval=773073799 TSecr=2816467215"
"285","75.232895","130.166.120.11","130.166.120.72","TCP","66","80  >  52950 [ACK] Seq=496 Ack=297 Win=64896 Len=0 TSval=2816467216 TSecr=773073799"
"286","75.233156","130.166.120.11","130.166.120.72","TCP","560","80  >  52950 [PSH, ACK] Seq=496 Ack=297 Win=64896 Len=494 TSval=2816467217 TSecr=773073799"
"287","75.233171","130.166.120.72","130.166.120.11","TCP","66","52950  >  80 [ACK] Seq=297 Ack=990 Win=64128 Len=0 TSval=773073800 TSecr=2816467217"
"288","75.233739","130.166.120.72","130.166.120.11","TCP","252","52950  >  80 [PSH, ACK] Seq=297 Ack=990 Win=64128 Len=186 TSval=773073800 TSecr=2816467217"
"289","75.233838","130.166.120.11","130.166.120.72","TCP","66","80  >  52950 [ACK] Seq=990 Ack=483 Win=64768 Len=0 TSval=2816467217 TSecr=773073800"
"290","75.234089","130.166.120.11","130.166.120.72","TCP","7306","80  >  52950 [PSH, ACK] Seq=990 Ack=483 Win=64768 Len=7240 TSval=2816467218 TSecr=773073800"
"291","75.234127","130.166.120.72","130.166.120.11","TCP","66","52950  >  80 [ACK] Seq=483 Ack=8230 Win=61312 Len=0 TSval=773073801 TSecr=2816467218"
"292","75.234144","130.166.120.11","130.166.120.72","TCP","7306","80  >  52950 [PSH, ACK] Seq=8230 Ack=483 Win=64768 Len=7240 TSval=2816467218 TSecr=773073800"
"293","75.234149","130.166.120.72","130.166.120.11","TCP","66","52950  >  80 [ACK] Seq=483 Ack=15470 Win=57088 Len=0 TSval=773073801 TSecr=2816467218"
"294","75.234178","130.166.120.11","130.166.120.72","TCP","14546","80  >  52950 [PSH, ACK] Seq=15470 Ack=483 Win=64768 Len=14480 TSval=2816467218 TSecr=773073801"
"295","75.234183","130.166.120.72","130.166.120.11","TCP","66","52950  >  80 [ACK] Seq=483 Ack=29950 Win=49792 Len=0 TSval=773073801 TSecr=2816467218"
"296","75.234188","130.166.120.11","130.166.120.72","TCP","14546","80  >  52950 [PSH, ACK] Seq=29950 Ack=483 Win=64768 Len=14480 TSval=2816467218 TSecr=773073801"
"297","75.234192","130.166.120.72","130.166.120.11","TCP","66","52950  >  80 [ACK] Seq=483 Ack=44430 Win=42624 Len=0 TSval=773073801 TSecr=2816467218"
"298","75.234199","130.166.120.11","130.166.120.72","TCP","2962","80  >  52950 [PSH, ACK] Seq=44430 Ack=483 Win=64768 Len=2896 TSval=2816467218 TSecr=773073801"
"299","75.234203","130.166.120.72","130.166.120.11","TCP","66","52950  >  80 [ACK] Seq=483 Ack=47326 Win=41088 Len=0 TSval=773073801 TSecr=2816467218"
"300","75.234207","130.166.120.11","130.166.120.72","TCP","29026","80  >  52950 [PSH, ACK] Seq=47326 Ack=483 Win=64768 Len=28960 TSval=2816467218 TSecr=773073801"
"301","75.234214","130.166.120.11","130.166.120.72","TCP","2962","80  >  52950 [PSH, ACK] Seq=76286 Ack=483 Win=64768 Len=2896 TSval=2816467218 TSecr=773073801"
"302","75.234218","130.166.120.11","130.166.120.72","TCP","7938","80  >  52950 [PSH, ACK] Seq=79182 Ack=483 Win=64768 Len=7872 TSval=2816467218 TSecr=773073801"
"303","75.234425","130.166.120.72","130.166.120.11","TCP","66","52950  >  80 [ACK] Seq=483 Ack=87054 Win=25472 Len=0 TSval=773073801 TSecr=2816467218"
"304","75.234487","130.166.120.11","130.166.120.72","TCP","25538","[TCP Window Full] 80  >  52950 [PSH, ACK] Seq=87054 Ack=483 Win=64768 Len=25472 TSval=2816467218 TSecr=773073801"
"305","75.234690","130.166.120.72","130.166.120.11","TCP","66","52950  >  80 [ACK] Seq=483 Ack=112526 Win=12672 Len=0 TSval=773073801 TSecr=2816467218"
"306","75.234744","130.166.120.11","130.166.120.72","TCP","6450","80  >  52950 [PSH, ACK] Seq=112526 Ack=483 Win=64768 Len=6384 TSval=2816467218 TSecr=773073801"
"307","75.234748","130.166.120.11","130.166.120.72","TCP","6354","[TCP Window Full] 80  >  52950 [PSH, ACK] Seq=118910 Ack=483 Win=64768 Len=6288 TSval=2816467218 TSecr=773073801"
"308","75.234862","130.166.120.72","130.166.120.11","TCP","66","52950  >  80 [ACK] Seq=483 Ack=125198 Win=6400 Len=0 TSval=773073801 TSecr=2816467218"
"309","75.234894","130.166.120.11","130.166.120.72","TCP","6466","[TCP Window Full] 80  >  52950 [PSH, ACK] Seq=125198 Ack=483 Win=64768 Len=6400 TSval=2816467218 TSecr=773073801"
"310","75.235082","130.166.120.72","130.166.120.11","TCP","66","52950  >  80 [ACK] Seq=483 Ack=131598 Win=64128 Len=0 TSval=773073802 TSecr=2816467218"
"311","75.235142","130.166.120.11","130.166.120.72","TCP","19234","80  >  52950 [PSH, ACK] Seq=131598 Ack=483 Win=64768 Len=19168 TSval=2816467219 TSecr=773073802"
"312","75.235145","130.166.120.11","130.166.120.72","TCP","30474","80  >  52950 [PSH, ACK] Seq=150766 Ack=483 Win=64768 Len=30408 TSval=2816467219 TSecr=773073802"
"313","75.235148","130.166.120.11","130.166.120.72","TCP","1514","80  >  52950 [ACK] Seq=181174 Ack=483 Win=64768 Len=1448 TSval=2816467219 TSecr=773073802"
"314","75.235151","130.166.120.11","130.166.120.72","TCP","8754","80  >  52950 [PSH, ACK] Seq=182622 Ack=483 Win=64768 Len=8688 TSval=2816467219 TSecr=773073802"
"315","75.235177","130.166.120.72","130.166.120.11","TCP","66","52950  >  80 [ACK] Seq=483 Ack=150766 Win=92544 Len=0 TSval=773073802 TSecr=2816467219"
"316","75.235196","130.166.120.11","130.166.120.72","TCP","20338","80  >  52950 [PSH, ACK] Seq=191310 Ack=483 Win=64768 Len=20272 TSval=2816467219 TSecr=773073802"
"317","75.235354","130.166.120.72","130.166.120.11","TCP","66","52950  >  80 [ACK] Seq=483 Ack=211582 Win=92032 Len=0 TSval=773073802 TSecr=2816467219"
"318","75.235427","130.166.120.11","130.166.120.72","TCP","2962","80  >  52950 [PSH, ACK] Seq=211582 Ack=483 Win=64768 Len=2896 TSval=2816467219 TSecr=773073802"
"319","75.235431","130.166.120.11","130.166.120.72","TCP","31922","80  >  52950 [PSH, ACK] Seq=214478 Ack=483 Win=64768 Len=31856 TSval=2816467219 TSecr=773073802"
"320","75.235434","130.166.120.11","130.166.120.72","TCP","29026","80  >  52950 [PSH, ACK] Seq=246334 Ack=483 Win=64768 Len=28960 TSval=2816467219 TSecr=773073802"
"321","75.235616","130.166.120.72","130.166.120.11","TCP","66","52950  >  80 [ACK] Seq=483 Ack=275294 Win=60160 Len=0 TSval=773073802 TSecr=2816467219"
"322","75.235676","130.166.120.11","130.166.120.72","TCP","2962","80  >  52950 [PSH, ACK] Seq=275294 Ack=483 Win=64768 Len=2896 TSval=2816467219 TSecr=773073802"
"323","75.235679","130.166.120.11","130.166.120.72","TCP","31922","80  >  52950 [PSH, ACK] Seq=278190 Ack=483 Win=64768 Len=31856 TSval=2816467219 TSecr=773073802"
"324","75.235682","130.166.120.11","130.166.120.72","TCP","25474","[TCP Window Full] 80  >  52950 [PSH, ACK] Seq=310046 Ack=483 Win=64768 Len=25408 TSval=2816467219 TSecr=773073802"
"325","75.235975","130.166.120.72","130.166.120.11","TCP","66","52950  >  80 [ACK] Seq=483 Ack=335454 Win=30080 Len=0 TSval=773073803 TSecr=2816467219"
"326","75.236044","130.166.120.11","130.166.120.72","TCP","6514","80  >  52950 [PSH, ACK] Seq=335454 Ack=483 Win=64768 Len=6448 TSval=2816467220 TSecr=773073803"
"327","75.236048","130.166.120.11","130.166.120.72","TCP","23698","[TCP Window Full] 80  >  52950 [PSH, ACK] Seq=341902 Ack=483 Win=64768 Len=23632 TSval=2816467220 TSecr=773073803"
"328","75.236217","130.166.120.72","130.166.120.11","TCP","66","52950  >  80 [ACK] Seq=483 Ack=365534 Win=14976 Len=0 TSval=773073803 TSecr=2816467220"
"329","75.236320","130.166.120.11","130.166.120.72","TCP","8290","80  >  52950 [PSH, ACK] Seq=365534 Ack=483 Win=64768 Len=8224 TSval=2816467220 TSecr=773073803"
"330","75.236324","130.166.120.11","130.166.120.72","TCP","6818","[TCP Window Full] 80  >  52950 [PSH, ACK] Seq=373758 Ack=483 Win=64768 Len=6752 TSval=2816467220 TSecr=773073803"
"331","75.236507","130.166.120.72","130.166.120.11","TCP","66","[TCP ZeroWindow] 52950  >  80 [ACK] Seq=483 Ack=380510 Win=0 Len=0 TSval=773073803 TSecr=2816467220"
"332","75.237312","130.166.120.72","130.166.120.11","TCP","66","[TCP Window Update] 52950  >  80 [ACK] Seq=483 Ack=380510 Win=79488 Len=0 TSval=773073804 TSecr=2816467220"
"333","75.237369","130.166.120.11","130.166.120.72","TCP","33370","80  >  52950 [PSH, ACK] Seq=380510 Ack=483 Win=64768 Len=33304 TSval=2816467221 TSecr=773073804"
"334","75.237372","130.166.120.11","130.166.120.72","TCP","4898","80  >  52950 [PSH, ACK] Seq=413814 Ack=483 Win=64768 Len=4832 TSval=2816467221 TSecr=773073804"
"335","75.237375","130.166.120.11","130.166.120.72","TCP","29026","80  >  52950 [PSH, ACK] Seq=418646 Ack=483 Win=64768 Len=28960 TSval=2816467221 TSecr=773073804"
"336","75.237532","130.166.120.72","130.166.120.11","TCP","66","52950  >  80 [ACK] Seq=483 Ack=447606 Win=44032 Len=0 TSval=773073804 TSecr=2816467221"
"337","75.237566","130.166.120.11","130.166.120.72","TCP","15994","80  >  52950 [PSH, ACK] Seq=447606 Ack=483 Win=64768 Len=15928 TSval=2816467221 TSecr=773073804"
"338","75.237569","130.166.120.11","130.166.120.72","TCP","28170","[TCP Window Full] 80  >  52950 [PSH, ACK] Seq=463534 Ack=483 Win=64768 Len=28104 TSval=2816467221 TSecr=773073804"
"339","75.237678","130.166.120.72","130.166.120.11","TCP","66","52950  >  80 [ACK] Seq=483 Ack=491638 Win=22016 Len=0 TSval=773073804 TSecr=2816467221"
"340","75.237712","130.166.120.11","130.166.120.72","TCP","16850","80  >  52950 [PSH, ACK] Seq=491638 Ack=483 Win=64768 Len=16784 TSval=2816467221 TSecr=773073804"
"341","75.237715","130.166.120.11","130.166.120.72","TCP","5298","[TCP Window Full] 80  >  52950 [PSH, ACK] Seq=508422 Ack=483 Win=64768 Len=5232 TSval=2816467221 TSecr=773073804"
"342","75.237860","130.166.120.72","130.166.120.11","TCP","66","52950  >  80 [ACK] Seq=483 Ack=513654 Win=26752 Len=0 TSval=773073804 TSecr=2816467221"
"343","75.237919","130.166.120.11","130.166.120.72","TCP","26818","[TCP Window Full] 80  >  52950 [PSH, ACK] Seq=513654 Ack=483 Win=64768 Len=26752 TSval=2816467221 TSecr=773073804"
"344","75.238048","130.166.120.72","130.166.120.11","TCP","66","52950  >  80 [ACK] Seq=483 Ack=540406 Win=14848 Len=0 TSval=773073805 TSecr=2816467221"
"345","75.238084","130.166.120.11","130.166.120.72","TCP","12970","80  >  52950 [PSH, ACK] Seq=540406 Ack=483 Win=64768 Len=12904 TSval=2816467222 TSecr=773073805"
"346","75.238087","130.166.120.11","130.166.120.72","TCP","2010","[TCP Window Full] 80  >  52950 [PSH, ACK] Seq=553310 Ack=483 Win=64768 Len=1944 TSval=2816467222 TSecr=773073805"
"347","75.238211","130.166.120.72","130.166.120.11","TCP","66","[TCP ZeroWindow] 52950  >  80 [ACK] Seq=483 Ack=555254 Win=0 Len=0 TSval=773073805 TSecr=2816467222"
"348","75.240216","130.166.120.72","130.166.120.11","TCP","66","[TCP Window Update] 52950  >  80 [ACK] Seq=483 Ack=555254 Win=92672 Len=0 TSval=773073807 TSecr=2816467222"
"349","75.240280","130.166.120.11","130.166.120.72","TCP","34818","80  >  52950 [PSH, ACK] Seq=555254 Ack=483 Win=64768 Len=34752 TSval=2816467224 TSecr=773073807"
"350","75.240285","130.166.120.11","130.166.120.72","TCP","8258","80  >  52950 [PSH, ACK] Seq=590006 Ack=483 Win=64768 Len=8192 TSval=2816467224 TSecr=773073807"
"351","75.240288","130.166.120.11","130.166.120.72","TCP","27578","80  >  52950 [PSH, ACK] Seq=598198 Ack=483 Win=64768 Len=27512 TSval=2816467224 TSecr=773073807"
"352","75.240446","130.166.120.72","130.166.120.11","TCP","66","52950  >  80 [ACK] Seq=483 Ack=625710 Win=71680 Len=0 TSval=773073807 TSecr=2816467224"
"353","75.240515","130.166.120.11","130.166.120.72","TCP","17442","80  >  52950 [PSH, ACK] Seq=625710 Ack=483 Win=64768 Len=17376 TSval=2816467224 TSecr=773073807"
"354","75.240519","130.166.120.11","130.166.120.72","TCP","36266","80  >  52950 [PSH, ACK] Seq=643086 Ack=483 Win=64768 Len=36200 TSval=2816467224 TSecr=773073807"
"355","75.240522","130.166.120.11","130.166.120.72","TCP","8754","80  >  52950 [PSH, ACK] Seq=679286 Ack=483 Win=64768 Len=8688 TSval=2816467224 TSecr=773073807"
"356","75.240526","130.166.120.11","130.166.120.72","TCP","9482","[TCP Window Full] 80  >  52950 [PSH, ACK] Seq=687974 Ack=483 Win=64768 Len=9416 TSval=2816467224 TSecr=773073807"
"357","75.240670","130.166.120.72","130.166.120.11","TCP","66","52950  >  80 [ACK] Seq=483 Ack=697390 Win=35840 Len=0 TSval=773073807 TSecr=2816467224"
"358","75.240740","130.166.120.11","130.166.120.72","TCP","35538","80  >  52950 [PSH, ACK] Seq=697390 Ack=483 Win=64768 Len=35472 TSval=2816467224 TSecr=773073807"
"359","75.240866","130.166.120.72","130.166.120.11","TCP","66","52950  >  80 [ACK] Seq=483 Ack=732862 Win=18176 Len=0 TSval=773073807 TSecr=2816467224"
"360","75.240899","130.166.120.11","130.166.120.72","TCP","18242","[TCP Window Full] 80  >  52950 [PSH, ACK] Seq=732862 Ack=483 Win=64768 Len=18176 TSval=2816467224 TSecr=773073807"
"361","75.241102","130.166.120.72","130.166.120.11","TCP","66","52950  >  80 [ACK] Seq=483 Ack=751038 Win=29440 Len=0 TSval=773073808 TSecr=2816467224"
"362","75.241144","130.166.120.11","130.166.120.72","TCP","26778","80  >  52950 [PSH, ACK] Seq=751038 Ack=483 Win=64768 Len=26712 TSval=2816467225 TSecr=773073808"
"363","75.241149","130.166.120.11","130.166.120.72","TCP","2794","[TCP Window Full] 80  >  52950 [PSH, ACK] Seq=777750 Ack=483 Win=64768 Len=2728 TSval=2816467225 TSecr=773073808"
"364","75.241296","130.166.120.72","130.166.120.11","TCP","66","52950  >  80 [ACK] Seq=483 Ack=780478 Win=14720 Len=0 TSval=773073808 TSecr=2816467225"
"365","75.241328","130.166.120.11","130.166.120.72","TCP","14786","[TCP Window Full] 80  >  52950 [PSH, ACK] Seq=780478 Ack=483 Win=64768 Len=14720 TSval=2816467225 TSecr=773073808"
"366","75.241449","130.166.120.72","130.166.120.11","TCP","66","[TCP ZeroWindow] 52950  >  80 [ACK] Seq=483 Ack=795198 Win=0 Len=0 TSval=773073808 TSecr=2816467225"
"367","75.243175","130.166.120.72","130.166.120.11","TCP","66","[TCP Window Update] 52950  >  80 [ACK] Seq=483 Ack=795198 Win=92672 Len=0 TSval=773073810 TSecr=2816467225"
"368","75.243232","130.166.120.11","130.166.120.72","TCP","27506","80  >  52950 [PSH, ACK] Seq=795198 Ack=483 Win=64768 Len=27440 TSval=2816467227 TSecr=773073810"
"369","75.243236","130.166.120.11","130.166.120.72","TCP","36266","80  >  52950 [PSH, ACK] Seq=822638 Ack=483 Win=64768 Len=36200 TSval=2816467227 TSecr=773073810"
"370","75.243240","130.166.120.11","130.166.120.72","TCP","8754","80  >  52950 [PSH, ACK] Seq=858838 Ack=483 Win=64768 Len=8688 TSval=2816467227 TSecr=773073810"
"371","75.243243","130.166.120.11","130.166.120.72","TCP","1514","80  >  52950 [ACK] Seq=867526 Ack=483 Win=64768 Len=1448 TSval=2816467227 TSecr=773073810"
"372","75.243391","130.166.120.72","130.166.120.11","TCP","66","52950  >  80 [ACK] Seq=483 Ack=868974 Win=58240 Len=0 TSval=773073810 TSecr=2816467227"
"373","75.243469","130.166.120.11","130.166.120.72","TCP","39162","80  >  52950 [PSH, ACK] Seq=868974 Ack=483 Win=64768 Len=39096 TSval=2816467227 TSecr=773073810"
"374","75.243473","130.166.120.11","130.166.120.72","TCP","4410","80  >  52950 [PSH, ACK] Seq=908070 Ack=483 Win=64768 Len=4344 TSval=2816467227 TSecr=773073810"
"375","75.243477","130.166.120.11","130.166.120.72","TCP","14866","[TCP Window Full] 80  >  52950 [PSH, ACK] Seq=912414 Ack=483 Win=64768 Len=14800 TSval=2816467227 TSecr=773073810"
"376","75.243626","130.166.120.72","130.166.120.11","TCP","66","52950  >  80 [ACK] Seq=483 Ack=927214 Win=29184 Len=0 TSval=773073810 TSecr=2816467227"
"377","75.243661","130.166.120.11","130.166.120.72","TCP","29250","[TCP Window Full] 80  >  52950 [PSH, ACK] Seq=927214 Ack=483 Win=64768 Len=29184 TSval=2816467227 TSecr=773073810"
"378","75.243786","130.166.120.72","130.166.120.11","TCP","66","52950  >  80 [ACK] Seq=483 Ack=956398 Win=14592 Len=0 TSval=773073810 TSecr=2816467227"
"379","75.243822","130.166.120.11","130.166.120.72","TCP","2418","80  >  52950 [PSH, ACK] Seq=956398 Ack=483 Win=64768 Len=2352 TSval=2816467227 TSecr=773073810"
"380","75.243826","130.166.120.11","130.166.120.72","TCP","12306","[TCP Window Full] 80  >  52950 [PSH, ACK] Seq=958750 Ack=483 Win=64768 Len=12240 TSval=2816467227 TSecr=773073810"
"381","75.244026","130.166.120.72","130.166.120.11","TCP","66","[TCP ZeroWindow] 52950  >  80 [ACK] Seq=483 Ack=970990 Win=0 Len=0 TSval=773073811 TSecr=2816467227"
"382","75.244263","130.166.120.72","130.166.120.11","TCP","66","[TCP Window Update] 52950  >  80 [ACK] Seq=483 Ack=970990 Win=65536 Len=0 TSval=773073811 TSecr=2816467227"
"383","75.244278","130.166.120.11","130.166.120.72","TCP","34162","80  >  52950 [PSH, ACK] Seq=970990 Ack=483 Win=64768 Len=34096 TSval=2816467228 TSecr=773073811"
"384","75.244280","130.166.120.11","130.166.120.72","TCP","31506","[TCP Window Full] 80  >  52950 [PSH, ACK] Seq=1005086 Ack=483 Win=64768 Len=31440 TSval=2816467228 TSecr=773073811"
"385","75.244357","130.166.120.72","130.166.120.11","TCP","66","52950  >  80 [ACK] Seq=483 Ack=1036526 Win=32768 Len=0 TSval=773073811 TSecr=2816467228"
"386","75.244391","130.166.120.11","130.166.120.72","TCP","14962","80  >  52950 [PSH, ACK] Seq=1036526 Ack=483 Win=64768 Len=14896 TSval=2816467228 TSecr=773073811"
"387","75.244393","130.166.120.11","130.166.120.72","TCP","17938","[TCP Window Full] 80  >  52950 [PSH, ACK] Seq=1051422 Ack=483 Win=64768 Len=17872 TSval=2816467228 TSecr=773073811"
"388","75.244457","130.166.120.72","130.166.120.11","TCP","66","52950  >  80 [ACK] Seq=483 Ack=1069294 Win=16384 Len=0 TSval=773073811 TSecr=2816467228"
"389","75.244496","130.166.120.11","130.166.120.72","TCP","16450","[TCP Window Full] 80  >  52950 [PSH, ACK] Seq=1069294 Ack=483 Win=64768 Len=16384 TSval=2816467228 TSecr=773073811"
"390","75.244536","130.166.120.72","130.166.120.11","TCP","66","[TCP ZeroWindow] 52950  >  80 [ACK] Seq=483 Ack=1085678 Win=0 Len=0 TSval=773073811 TSecr=2816467228"
"391","75.244867","130.166.120.72","130.166.120.11","TCP","66","[TCP Window Update] 52950  >  80 [ACK] Seq=483 Ack=1085678 Win=92672 Len=0 TSval=773073811 TSecr=2816467228"
"392","75.244887","130.166.120.11","130.166.120.72","TCP","12146","80  >  52950 [PSH, ACK] Seq=1085678 Ack=483 Win=64768 Len=12080 TSval=2816467228 TSecr=773073811"
"393","75.244888","130.166.120.11","130.166.120.72","TCP","39162","80  >  52950 [PSH, ACK] Seq=1097758 Ack=483 Win=64768 Len=39096 TSval=2816467228 TSecr=773073811"
"394","75.244890","130.166.120.11","130.166.120.72","TCP","7306","80  >  52950 [PSH, ACK] Seq=1136854 Ack=483 Win=64768 Len=7240 TSval=2816467228 TSecr=773073811"
"395","75.244891","130.166.120.11","130.166.120.72","TCP","18890","80  >  52950 [PSH, ACK] Seq=1144094 Ack=483 Win=64768 Len=18824 TSval=2816467228 TSecr=773073811"
"396","75.244960","130.166.120.72","130.166.120.11","TCP","66","52950  >  80 [ACK] Seq=483 Ack=1162918 Win=67968 Len=0 TSval=773073812 TSecr=2816467228"
"397","75.244975","130.166.120.11","130.166.120.72","TCP","27578","80  >  52950 [PSH, ACK] Seq=1162918 Ack=483 Win=64768 Len=27512 TSval=2816467229 TSecr=773073812"
"398","75.244977","130.166.120.11","130.166.120.72","TCP","40522","[TCP Window Full] 80  >  52950 [PSH, ACK] Seq=1190430 Ack=483 Win=64768 Len=40456 TSval=2816467229 TSecr=773073812"
"399","75.245054","130.166.120.72","130.166.120.11","TCP","66","52950  >  80 [ACK] Seq=483 Ack=1230886 Win=34048 Len=0 TSval=773073812 TSecr=2816467229"
"400","75.245071","130.166.120.11","130.166.120.72","TCP","5946","80  >  52950 [PSH, ACK] Seq=1230886 Ack=483 Win=64768 Len=5880 TSval=2816467229 TSecr=773073812"
"401","75.245073","130.166.120.11","130.166.120.72","TCP","28234","[TCP Window Full] 80  >  52950 [PSH, ACK] Seq=1236766 Ack=483 Win=64768 Len=28168 TSval=2816467229 TSecr=773073812"
"402","75.245137","130.166.120.72","130.166.120.11","TCP","66","52950  >  80 [ACK] Seq=483 Ack=1264934 Win=17024 Len=0 TSval=773073812 TSecr=2816467229"
"403","75.245150","130.166.120.11","130.166.120.72","TCP","17090","[TCP Window Full] 80  >  52950 [PSH, ACK] Seq=1264934 Ack=483 Win=64768 Len=17024 TSval=2816467229 TSecr=773073812"
"404","75.245192","130.166.120.72","130.166.120.11","TCP","66","52950  >  80 [ACK] Seq=483 Ack=1281958 Win=22912 Len=0 TSval=773073812 TSecr=2816467229"
"405","75.245205","130.166.120.11","130.166.120.72","TCP","1210","80  >  52950 [ACK] Seq=1281958 Ack=483 Win=64768 Len=1144 TSval=2816467229 TSecr=773073812"
"406","75.245207","130.166.120.11","130.166.120.72","TCP","21834","[TCP Window Full] 80  >  52950 [PSH, ACK] Seq=1283102 Ack=483 Win=64768 Len=21768 TSval=2816467229 TSecr=773073812"
"407","75.245252","130.166.120.72","130.166.120.11","TCP","66","[TCP ZeroWindow] 52950  >  80 [ACK] Seq=483 Ack=1304870 Win=0 Len=0 TSval=773073812 TSecr=2816467229"
"408","75.245355","130.166.120.72","130.166.120.11","TCP","66","[TCP Window Update] 52950  >  80 [ACK] Seq=483 Ack=1304870 Win=28800 Len=0 TSval=773073812 TSecr=2816467229"
"409","75.245369","130.166.120.11","130.166.120.72","TCP","24634","80  >  52950 [PSH, ACK] Seq=1304870 Ack=483 Win=64768 Len=24568 TSval=2816467229 TSecr=773073812"
"410","75.245371","130.166.120.11","130.166.120.72","TCP","4298","[TCP Window Full] 80  >  52950 [PSH, ACK] Seq=1329438 Ack=483 Win=64768 Len=4232 TSval=2816467229 TSecr=773073812"
"411","75.245425","130.166.120.72","130.166.120.11","TCP","66","52950  >  80 [ACK] Seq=483 Ack=1333670 Win=19456 Len=0 TSval=773073812 TSecr=2816467229"
"412","75.245437","130.166.120.11","130.166.120.72","TCP","19522","[TCP Window Full] 80  >  52950 [PSH, ACK] Seq=1333670 Ack=483 Win=64768 Len=19456 TSval=2816467229 TSecr=773073812"
"413","75.245480","130.166.120.72","130.166.120.11","TCP","66","[TCP ZeroWindow] 52950  >  80 [ACK] Seq=483 Ack=1353126 Win=0 Len=0 TSval=773073812 TSecr=2816467229"
"414","75.246217","130.166.120.72","130.166.120.11","TCP","66","[TCP Window Update] 52950  >  80 [ACK] Seq=483 Ack=1353126 Win=92672 Len=0 TSval=773073813 TSecr=2816467229"
"415","75.246247","130.166.120.11","130.166.120.72","TCP","22714","80  >  52950 [PSH, ACK] Seq=1353126 Ack=483 Win=64768 Len=22648 TSval=2816467230 TSecr=773073813"
"416","75.246249","130.166.120.11","130.166.120.72","TCP","40610","80  >  52950 [PSH, ACK] Seq=1375774 Ack=483 Win=64768 Len=40544 TSval=2816467230 TSecr=773073813"
"417","75.246250","130.166.120.11","130.166.120.72","TCP","5858","80  >  52950 [PSH, ACK] Seq=1416318 Ack=483 Win=64768 Len=5792 TSval=2816467230 TSecr=773073813"
"418","75.246252","130.166.120.11","130.166.120.72","TCP","13098","80  >  52950 [PSH, ACK] Seq=1422110 Ack=483 Win=64768 Len=13032 TSval=2816467230 TSecr=773073813"
"419","75.246318","130.166.120.72","130.166.120.11","TCP","66","52950  >  80 [ACK] Seq=483 Ack=1435142 Win=70272 Len=0 TSval=773073813 TSecr=2816467230"
"420","75.246333","130.166.120.11","130.166.120.72","TCP","33370","80  >  52950 [PSH, ACK] Seq=1435142 Ack=483 Win=64768 Len=33304 TSval=2816467230 TSecr=773073813"
"421","75.246334","130.166.120.11","130.166.120.72","TCP","4582","80  >  52950 [PSH, ACK] Seq=1468446 Ack=483 Win=64768 Len=4516 TSval=2816467230 TSecr=773073813"
"422","75.246407","130.166.120.72","130.166.120.11","TCP","66","52950  >  80 [ACK] Seq=483 Ack=1472962 Win=51328 Len=0 TSval=773073813 TSecr=2816467230"
"423","75.248531","130.166.120.72","130.166.120.11","TCP","66","52950  >  80 [FIN, ACK] Seq=483 Ack=1472962 Win=92672 Len=0 TSval=773073815 TSecr=2816467230"
"424","75.248651","130.166.120.11","130.166.120.72","TCP","66","80  >  52950 [FIN, ACK] Seq=1472962 Ack=484 Win=64768 Len=0 TSval=2816467232 TSecr=773073815"
"425","75.248665","130.166.120.72","130.166.120.11","TCP","66","52950  >  80 [ACK] Seq=484 Ack=1472963 Win=92672 Len=0 TSval=773073815 TSecr=2816467232"
"426","76.281340","130.166.120.72","70.184.98.27","DNS","72","Standard query 0xa594 A www.luna.net"
"427","76.281448","130.166.120.72","70.184.98.27","DNS","72","Standard query 0xba8d AAAA www.luna.net"
"428","76.297074","70.184.98.27","130.166.120.72","DNS","88","Standard query response 0xa594 A www.luna.net A 149.90.40.13"
"429","76.317593","70.184.98.27","130.166.120.72","DNS","116","Standard query response 0xba8d AAAA www.luna.net SOA ns.luna.net"
"430","76.317931","130.166.120.72","149.90.40.13","TCP","74","52668  >  80 [SYN] Seq=0 Win=64240 Len=0 MSS=1460 SACK_PERM TSval=3625133427 TSecr=0 WS=128"
"431","76.318132","149.90.40.13","130.166.120.72","TCP","74","80  >  52668 [SYN, ACK] Seq=0 Ack=1 Win=65160 Len=0 MSS=1460 SACK_PERM TSval=3610687681 TSecr=3625133427 WS=128"
"432","76.318160","130.166.120.72","149.90.40.13","TCP","66","52668  >  80 [ACK] Seq=1 Ack=1 Win=64256 Len=0 TSval=3625133427 TSecr=3610687681"
"433","76.318310","130.166.120.72","149.90.40.13","TCP","205","52668  >  80 [PSH, ACK] Seq=1 Ack=1 Win=64256 Len=139 TSval=3625133427 TSecr=3610687681"
"434","76.318454","149.90.40.13","130.166.120.72","TCP","66","80  >  52668 [ACK] Seq=1 Ack=140 Win=65024 Len=0 TSval=3610687681 TSecr=3625133427"
"435","76.319682","149.90.40.13","130.166.120.72","TCP","583","80  >  52668 [PSH, ACK] Seq=1 Ack=140 Win=65024 Len=517 TSval=3610687682 TSecr=3625133427"
"436","76.319698","130.166.120.72","149.90.40.13","TCP","66","52668  >  80 [ACK] Seq=140 Ack=518 Win=64128 Len=0 TSval=3625133428 TSecr=3610687682"
"437","76.321382","130.166.120.72","149.90.40.13","TCP","215","52668  >  80 [PSH, ACK] Seq=140 Ack=518 Win=64128 Len=149 TSval=3625133430 TSecr=3610687682"
"438","76.321543","149.90.40.13","130.166.120.72","TCP","66","80  >  52668 [ACK] Seq=518 Ack=289 Win=64896 Len=0 TSval=3610687684 TSecr=3625133430"
"439","76.321915","149.90.40.13","130.166.120.72","TCP","556","80  >  52668 [PSH, ACK] Seq=518 Ack=289 Win=64896 Len=490 TSval=3610687684 TSecr=3625133430"
"440","76.321927","130.166.120.72","149.90.40.13","TCP","66","52668  >  80 [ACK] Seq=289 Ack=1008 Win=64128 Len=0 TSval=3625133431 TSecr=3610687684"
"441","76.322335","130.166.120.72","149.90.40.13","TCP","244","52668  >  80 [PSH, ACK] Seq=289 Ack=1008 Win=64128 Len=178 TSval=3625133431 TSecr=3610687684"
"442","76.322461","149.90.40.13","130.166.120.72","TCP","66","80  >  52668 [ACK] Seq=1008 Ack=467 Win=64768 Len=0 TSval=3610687685 TSecr=3625133431"
"443","76.322854","149.90.40.13","130.166.120.72","TCP","7306","80  >  52668 [PSH, ACK] Seq=1008 Ack=467 Win=64768 Len=7240 TSval=3610687685 TSecr=3625133431"
"444","76.322893","130.166.120.72","149.90.40.13","TCP","66","52668  >  80 [ACK] Seq=467 Ack=8248 Win=61312 Len=0 TSval=3625133431 TSecr=3610687685"
"445","76.322966","149.90.40.13","130.166.120.72","TCP","7306","80  >  52668 [PSH, ACK] Seq=8248 Ack=467 Win=64768 Len=7240 TSval=3610687686 TSecr=3625133431"
"446","76.322975","130.166.120.72","149.90.40.13","TCP","66","52668  >  80 [ACK] Seq=467 Ack=15488 Win=57728 Len=0 TSval=3625133432 TSecr=3610687686"
"447","76.323114","149.90.40.13","130.166.120.72","TCP","10202","80  >  52668 [PSH, ACK] Seq=15488 Ack=467 Win=64768 Len=10136 TSval=3610687686 TSecr=3625133431"
"448","76.323122","130.166.120.72","149.90.40.13","TCP","66","52668  >  80 [ACK] Seq=467 Ack=25624 Win=52608 Len=0 TSval=3625133432 TSecr=3610687686"
"449","76.323474","149.90.40.13","130.166.120.72","TCP","4410","80  >  52668 [PSH, ACK] Seq=25624 Ack=467 Win=64768 Len=4344 TSval=3610687686 TSecr=3625133431"
"450","76.323483","130.166.120.72","149.90.40.13","TCP","66","52668  >  80 [ACK] Seq=467 Ack=29968 Win=62848 Len=0 TSval=3625133432 TSecr=3610687686"
"451","76.323640","149.90.40.13","130.166.120.72","TCP","14546","80  >  52668 [PSH, ACK] Seq=29968 Ack=467 Win=64768 Len=14480 TSval=3610687686 TSecr=3625133432"
"452","76.323648","130.166.120.72","149.90.40.13","TCP","66","52668  >  80 [ACK] Seq=467 Ack=44448 Win=57728 Len=0 TSval=3625133432 TSecr=3610687686"
"453","76.323837","149.90.40.13","130.166.120.72","TCP","2962","80  >  52668 [PSH, ACK] Seq=44448 Ack=467 Win=64768 Len=2896 TSval=3610687686 TSecr=3625133432"
"454","76.323843","130.166.120.72","149.90.40.13","TCP","66","52668  >  80 [ACK] Seq=467 Ack=47344 Win=69888 Len=0 TSval=3625133432 TSecr=3610687686"
"455","76.324162","149.90.40.13","130.166.120.72","TCP","29026","80  >  52668 [PSH, ACK] Seq=47344 Ack=467 Win=64768 Len=28960 TSval=3610687686 TSecr=3625133432"
"456","76.324195","130.166.120.72","149.90.40.13","TCP","66","52668  >  80 [ACK] Seq=467 Ack=76304 Win=127872 Len=0 TSval=3625133433 TSecr=3610687686"
"457","76.324332","149.90.40.13","130.166.120.72","TCP","2962","80  >  52668 [PSH, ACK] Seq=76304 Ack=467 Win=64768 Len=2896 TSval=3610687686 TSecr=3625133432"
"458","76.324340","130.166.120.72","149.90.40.13","TCP","66","52668  >  80 [ACK] Seq=467 Ack=79200 Win=133632 Len=0 TSval=3625133433 TSecr=3610687686"
"459","76.324719","149.90.40.13","130.166.120.72","TCP","23042","80  >  52668 [PSH, ACK] Seq=79200 Ack=467 Win=64768 Len=22976 TSval=3610687686 TSecr=3625133432"
"460","76.324735","130.166.120.72","149.90.40.13","TCP","66","52668  >  80 [ACK] Seq=467 Ack=102176 Win=179584 Len=0 TSval=3625133433 TSecr=3610687686"
"461","76.324722","149.90.40.13","130.166.120.72","TCP","8946","80  >  52668 [PSH, ACK] Seq=102176 Ack=467 Win=64768 Len=8880 TSval=3610687687 TSecr=3625133433"
"462","76.324769","130.166.120.72","149.90.40.13","TCP","66","52668  >  80 [ACK] Seq=467 Ack=111056 Win=197376 Len=0 TSval=3625133433 TSecr=3610687687"
"463","76.324724","149.90.40.13","130.166.120.72","TCP","46402","80  >  52668 [PSH, ACK] Seq=111056 Ack=467 Win=64768 Len=46336 TSval=3610687687 TSecr=3625133433"
"464","76.324784","130.166.120.72","149.90.40.13","TCP","66","52668  >  80 [ACK] Seq=467 Ack=157392 Win=290048 Len=0 TSval=3625133433 TSecr=3610687687"
"465","76.325122","149.90.40.13","130.166.120.72","TCP","36266","80  >  52668 [PSH, ACK] Seq=157392 Ack=467 Win=64768 Len=36200 TSval=3610687687 TSecr=3625133433"
"466","76.325142","130.166.120.72","149.90.40.13","TCP","66","52668  >  80 [ACK] Seq=467 Ack=193592 Win=362496 Len=0 TSval=3625133434 TSecr=3610687687"
"467","76.325125","149.90.40.13","130.166.120.72","TCP","29026","80  >  52668 [PSH, ACK] Seq=193592 Ack=467 Win=64768 Len=28960 TSval=3610687687 TSecr=3625133433"
"468","76.325155","130.166.120.72","149.90.40.13","TCP","66","52668  >  80 [ACK] Seq=467 Ack=222552 Win=364928 Len=0 TSval=3625133434 TSecr=3610687687"
"469","76.325128","149.90.40.13","130.166.120.72","TCP","30474","80  >  52668 [PSH, ACK] Seq=222552 Ack=467 Win=64768 Len=30408 TSval=3610687687 TSecr=3625133433"
"470","76.325168","130.166.120.72","149.90.40.13","TCP","66","52668  >  80 [ACK] Seq=467 Ack=252960 Win=349696 Len=0 TSval=3625133434 TSecr=3610687687"
"471","76.325452","149.90.40.13","130.166.120.72","TCP","34818","80  >  52668 [PSH, ACK] Seq=252960 Ack=467 Win=64768 Len=34752 TSval=3610687688 TSecr=3625133434"
"472","76.325456","149.90.40.13","130.166.120.72","TCP","34818","80  >  52668 [PSH, ACK] Seq=287712 Ack=467 Win=64768 Len=34752 TSval=3610687688 TSecr=3625133434"
"473","76.325459","149.90.40.13","130.166.120.72","TCP","30474","80  >  52668 [PSH, ACK] Seq=322464 Ack=467 Win=64768 Len=30408 TSval=3610687688 TSecr=3625133434"
"474","76.325462","149.90.40.13","130.166.120.72","TCP","1514","80  >  52668 [ACK] Seq=352872 Ack=467 Win=64768 Len=1448 TSval=3610687688 TSecr=3625133434"
"475","76.325518","130.166.120.72","149.90.40.13","TCP","66","52668  >  80 [ACK] Seq=467 Ack=287712 Win=315008 Len=0 TSval=3625133434 TSecr=3610687688"
"476","76.325665","149.90.40.13","130.166.120.72","TCP","36266","80  >  52668 [PSH, ACK] Seq=354320 Ack=467 Win=64768 Len=36200 TSval=3610687688 TSecr=3625133434"
"477","76.325794","130.166.120.72","149.90.40.13","TCP","66","52668  >  80 [ACK] Seq=467 Ack=390520 Win=280320 Len=0 TSval=3625133434 TSecr=3610687688"
"478","76.326044","149.90.40.13","130.166.120.72","TCP","27578","80  >  52668 [PSH, ACK] Seq=390520 Ack=467 Win=64768 Len=27512 TSval=3610687688 TSecr=3625133434"
"479","76.326047","149.90.40.13","130.166.120.72","TCP","53642","80  >  52668 [PSH, ACK] Seq=418032 Ack=467 Win=64768 Len=53576 TSval=3610687688 TSecr=3625133434"
"480","76.326050","149.90.40.13","130.166.120.72","TCP","11650","80  >  52668 [PSH, ACK] Seq=471608 Ack=467 Win=64768 Len=11584 TSval=3610687688 TSecr=3625133434"
"481","76.326053","149.90.40.13","130.166.120.72","TCP","14546","80  >  52668 [PSH, ACK] Seq=483192 Ack=467 Win=64768 Len=14480 TSval=3610687688 TSecr=3625133434"
"482","76.326210","130.166.120.72","149.90.40.13","TCP","66","52668  >  80 [ACK] Seq=467 Ack=497672 Win=226688 Len=0 TSval=3625133435 TSecr=3610687688"
"483","76.326456","149.90.40.13","130.166.120.72","TCP","50746","80  >  52668 [PSH, ACK] Seq=497672 Ack=467 Win=64768 Len=50680 TSval=3610687689 TSecr=3625133435"
"484","76.326459","149.90.40.13","130.166.120.72","TCP","56538","80  >  52668 [PSH, ACK] Seq=548352 Ack=467 Win=64768 Len=56472 TSval=3610687689 TSecr=3625133435"
"485","76.326462","149.90.40.13","130.166.120.72","TCP","5858","80  >  52668 [PSH, ACK] Seq=604824 Ack=467 Win=64768 Len=5792 TSval=3610687689 TSecr=3625133435"
"486","76.326623","130.166.120.72","149.90.40.13","TCP","66","52668  >  80 [ACK] Seq=467 Ack=610616 Win=169472 Len=0 TSval=3625133435 TSecr=3610687689"
"487","76.326981","149.90.40.13","130.166.120.72","TCP","2962","80  >  52668 [PSH, ACK] Seq=610616 Ack=467 Win=64768 Len=2896 TSval=3610687689 TSecr=3625133435"
"488","76.326984","149.90.40.13","130.166.120.72","TCP","59434","80  >  52668 [PSH, ACK] Seq=613512 Ack=467 Win=64768 Len=59368 TSval=3610687689 TSecr=3625133435"
"489","76.326987","149.90.40.13","130.166.120.72","TCP","5858","80  >  52668 [PSH, ACK] Seq=672880 Ack=467 Win=64768 Len=5792 TSval=3610687689 TSecr=3625133435"
"490","76.326990","149.90.40.13","130.166.120.72","TCP","50746","80  >  52668 [PSH, ACK] Seq=678672 Ack=467 Win=64768 Len=50680 TSval=3610687689 TSecr=3625133435"
"491","76.327203","130.166.120.72","149.90.40.13","TCP","66","52668  >  80 [ACK] Seq=467 Ack=729352 Win=110080 Len=0 TSval=3625133436 TSecr=3610687689"
"492","76.327538","149.90.40.13","130.166.120.72","TCP","14546","80  >  52668 [PSH, ACK] Seq=729352 Ack=467 Win=64768 Len=14480 TSval=3610687690 TSecr=3625133436"
"493","76.327540","149.90.40.13","130.166.120.72","TCP","62330","80  >  52668 [PSH, ACK] Seq=743832 Ack=467 Win=64768 Len=62264 TSval=3610687690 TSecr=3625133436"
"494","76.327544","149.90.40.13","130.166.120.72","TCP","2962","80  >  52668 [PSH, ACK] Seq=806096 Ack=467 Win=64768 Len=2896 TSval=3610687690 TSecr=3625133436"
"495","76.327547","149.90.40.13","130.166.120.72","TCP","30506","[TCP Window Full] 80  >  52668 [PSH, ACK] Seq=808992 Ack=467 Win=64768 Len=30440 TSval=3610687690 TSecr=3625133436"
"496","76.327703","130.166.120.72","149.90.40.13","TCP","66","52668  >  80 [ACK] Seq=467 Ack=839432 Win=54400 Len=0 TSval=3625133436 TSecr=3610687690"
"497","76.327876","149.90.40.13","130.166.120.72","TCP","34786","80  >  52668 [PSH, ACK] Seq=839432 Ack=467 Win=64768 Len=34720 TSval=3610687690 TSecr=3625133436"
"498","76.327879","149.90.40.13","130.166.120.72","TCP","19746","[TCP Window Full] 80  >  52668 [PSH, ACK] Seq=874152 Ack=467 Win=64768 Len=19680 TSval=3610687690 TSecr=3625133436"
"499","76.328113","130.166.120.72","149.90.40.13","TCP","66","[TCP ZeroWindow] 52668  >  80 [ACK] Seq=467 Ack=893832 Win=0 Len=0 TSval=3625133437 TSecr=3610687690"
"500","76.329235","130.166.120.72","149.90.40.13","TCP","66","[TCP Window Update] 52668  >  80 [ACK] Seq=467 Ack=893832 Win=132096 Len=0 TSval=3625133438 TSecr=3610687690"
"501","76.329497","149.90.40.13","130.166.120.72","TCP","45546","80  >  52668 [PSH, ACK] Seq=893832 Ack=467 Win=64768 Len=45480 TSval=3610687692 TSecr=3625133438"
"502","76.329499","149.90.40.13","130.166.120.72","TCP","62330","80  >  52668 [PSH, ACK] Seq=939312 Ack=467 Win=64768 Len=62264 TSval=3610687692 TSecr=3625133438"
"503","76.329502","149.90.40.13","130.166.120.72","TCP","2962","80  >  52668 [PSH, ACK] Seq=1001576 Ack=467 Win=64768 Len=2896 TSval=3610687692 TSecr=3625133438"
"504","76.329504","149.90.40.13","130.166.120.72","TCP","13098","80  >  52668 [PSH, ACK] Seq=1004472 Ack=467 Win=64768 Len=13032 TSval=3610687692 TSecr=3625133438"
"505","76.329650","130.166.120.72","149.90.40.13","TCP","66","52668  >  80 [ACK] Seq=467 Ack=1017504 Win=69632 Len=0 TSval=3625133438 TSecr=3610687692"
"506","76.329819","149.90.40.13","130.166.120.72","TCP","52194","80  >  52668 [PSH, ACK] Seq=1017504 Ack=467 Win=64768 Len=52128 TSval=3610687692 TSecr=3625133438"
"507","76.329822","149.90.40.13","130.166.120.72","TCP","17570","[TCP Window Full] 80  >  52668 [PSH, ACK] Seq=1069632 Ack=467 Win=64768 Len=17504 TSval=3610687692 TSecr=3625133438"
"508","76.329927","130.166.120.72","149.90.40.13","TCP","66","52668  >  80 [ACK] Seq=467 Ack=1087136 Win=34816 Len=0 TSval=3625133439 TSecr=3610687692"
"509","76.330006","149.90.40.13","130.166.120.72","TCP","34882","[TCP Window Full] 80  >  52668 [PSH, ACK] Seq=1087136 Ack=467 Win=64768 Len=34816 TSval=3610687693 TSecr=3625133439"
"510","76.330116","130.166.120.72","149.90.40.13","TCP","66","[TCP ZeroWindow] 52668  >  80 [ACK] Seq=467 Ack=1121952 Win=0 Len=0 TSval=3625133439 TSecr=3610687693"
"511","76.331289","130.166.120.72","149.90.40.13","TCP","66","[TCP Window Update] 52668  >  80 [ACK] Seq=467 Ack=1121952 Win=129280 Len=0 TSval=3625133440 TSecr=3610687693"
"512","76.331427","149.90.40.13","130.166.120.72","TCP","12906","80  >  52668 [PSH, ACK] Seq=1121952 Ack=467 Win=64768 Len=12840 TSval=3610687694 TSecr=3625133440"
"513","76.331428","149.90.40.13","130.166.120.72","TCP","65226","80  >  52668 [PSH, ACK] Seq=1134792 Ack=467 Win=64768 Len=65160 TSval=3610687694 TSecr=3625133440"
"514","76.331429","149.90.40.13","130.166.120.72","TCP","51346","[TCP Window Full] 80  >  52668 [PSH, ACK] Seq=1199952 Ack=467 Win=64768 Len=51280 TSval=3610687694 TSecr=3625133440"
"515","76.331495","130.166.120.72","149.90.40.13","TCP","66","52668  >  80 [ACK] Seq=467 Ack=1251232 Win=64000 Len=0 TSval=3625133440 TSecr=3610687694"
"516","76.331609","149.90.40.13","130.166.120.72","TCP","13946","80  >  52668 [PSH, ACK] Seq=1251232 Ack=467 Win=64768 Len=13880 TSval=3610687694 TSecr=3625133440"
"517","76.331610","149.90.40.13","130.166.120.72","TCP","50186","[TCP Window Full] 80  >  52668 [PSH, ACK] Seq=1265112 Ack=467 Win=64768 Len=50120 TSval=3610687694 TSecr=3625133440"
"518","76.331686","130.166.120.72","149.90.40.13","TCP","66","[TCP ZeroWindow] 52668  >  80 [ACK] Seq=467 Ack=1315232 Win=0 Len=0 TSval=3625133440 TSecr=3610687694"
"519","76.331855","130.166.120.72","149.90.40.13","TCP","66","[TCP Window Update] 52668  >  80 [ACK] Seq=467 Ack=1315232 Win=137600 Len=0 TSval=3625133440 TSecr=3610687694"
"520","76.332014","149.90.40.13","130.166.120.72","TCP","15106","80  >  52668 [PSH, ACK] Seq=1315232 Ack=467 Win=64768 Len=15040 TSval=3610687694 TSecr=3625133440"
"521","76.332015","149.90.40.13","130.166.120.72","TCP","65226","80  >  52668 [PSH, ACK] Seq=1330272 Ack=467 Win=64768 Len=65160 TSval=3610687694 TSecr=3625133440"
"522","76.332016","149.90.40.13","130.166.120.72","TCP","56538","80  >  52668 [PSH, ACK] Seq=1395432 Ack=467 Win=64768 Len=56472 TSval=3610687694 TSecr=3625133440"
"523","76.332110","130.166.120.72","149.90.40.13","TCP","66","52668  >  80 [ACK] Seq=467 Ack=1451904 Win=68736 Len=0 TSval=3625133441 TSecr=3610687694"
"524","76.332191","149.90.40.13","130.166.120.72","TCP","8754","80  >  52668 [PSH, ACK] Seq=1451904 Ack=467 Win=64768 Len=8688 TSval=3610687695 TSecr=3625133441"
"525","76.332192","149.90.40.13","130.166.120.72","TCP","60114","[TCP Window Full] 80  >  52668 [PSH, ACK] Seq=1460592 Ack=467 Win=64768 Len=60048 TSval=3610687695 TSecr=3625133441"
"526","76.332257","130.166.120.72","149.90.40.13","TCP","66","[TCP ZeroWindow] 52668  >  80 [ACK] Seq=467 Ack=1520640 Win=0 Len=0 TSval=3625133441 TSecr=3610687695"
"527","76.333134","130.166.120.72","149.90.40.13","TCP","66","[TCP Window Update] 52668  >  80 [ACK] Seq=467 Ack=1520640 Win=150784 Len=0 TSval=3625133442 TSecr=3610687695"
"528","76.333341","149.90.40.13","130.166.120.72","TCP","5178","80  >  52668 [PSH, ACK] Seq=1520640 Ack=467 Win=64768 Len=5112 TSval=3610687696 TSecr=3625133442"
"529","76.333342","149.90.40.13","130.166.120.72","TCP","65226","80  >  52668 [PSH, ACK] Seq=1525752 Ack=467 Win=64768 Len=65160 TSval=3610687696 TSecr=3625133442"
"530","76.333343","149.90.40.13","130.166.120.72","TCP","65226","80  >  52668 [PSH, ACK] Seq=1590912 Ack=467 Win=64768 Len=65160 TSval=3610687696 TSecr=3625133442"
"531","76.333344","149.90.40.13","130.166.120.72","TCP","8754","80  >  52668 [PSH, ACK] Seq=1656072 Ack=467 Win=64768 Len=8688 TSval=3610687696 TSecr=3625133442"
"532","76.333426","130.166.120.72","149.90.40.13","TCP","66","52668  >  80 [ACK] Seq=467 Ack=1664760 Win=78080 Len=0 TSval=3625133442 TSecr=3610687696"
"533","76.333552","149.90.40.13","130.166.120.72","TCP","56538","80  >  52668 [PSH, ACK] Seq=1664760 Ack=467 Win=64768 Len=56472 TSval=3610687696 TSecr=3625133442"
"534","76.333553","149.90.40.13","130.166.120.72","TCP","21674","[TCP Window Full] 80  >  52668 [PSH, ACK] Seq=1721232 Ack=467 Win=64768 Len=21608 TSval=3610687696 TSecr=3625133442"
"535","76.333629","130.166.120.72","149.90.40.13","TCP","66","52668  >  80 [ACK] Seq=467 Ack=1742840 Win=39040 Len=0 TSval=3625133442 TSecr=3610687696"
"536","76.333679","149.90.40.13","130.166.120.72","TCP","39106","[TCP Window Full] 80  >  52668 [PSH, ACK] Seq=1742840 Ack=467 Win=64768 Len=39040 TSval=3610687696 TSecr=3625133442"
"537","76.333757","130.166.120.72","149.90.40.13","TCP","66","[TCP ZeroWindow] 52668  >  80 [ACK] Seq=467 Ack=1781880 Win=0 Len=0 TSval=3625133442 TSecr=3610687696"
"538","76.334451","130.166.120.72","149.90.40.13","TCP","66","[TCP Window Update] 52668  >  80 [ACK] Seq=467 Ack=1781880 Win=102400 Len=0 TSval=3625133443 TSecr=3610687696"
"539","76.334572","149.90.40.13","130.166.120.72","TCP","4578","80  >  52668 [PSH, ACK] Seq=1781880 Ack=467 Win=64768 Len=4512 TSval=3610687697 TSecr=3625133443"
"540","76.334574","149.90.40.13","130.166.120.72","TCP","65226","80  >  52668 [PSH, ACK] Seq=1786392 Ack=467 Win=64768 Len=65160 TSval=3610687697 TSecr=3625133443"
"541","76.334575","149.90.40.13","130.166.120.72","TCP","32794","[TCP Window Full] 80  >  52668 [PSH, ACK] Seq=1851552 Ack=467 Win=64768 Len=32728 TSval=3610687697 TSecr=3625133443"
"542","76.334643","130.166.120.72","149.90.40.13","TCP","66","52668  >  80 [ACK] Seq=467 Ack=1884280 Win=50560 Len=0 TSval=3625133443 TSecr=3610687697"
"543","76.334697","149.90.40.13","130.166.120.72","TCP","32498","80  >  52668 [PSH, ACK] Seq=1884280 Ack=467 Win=64768 Len=32432 TSval=3610687697 TSecr=3625133443"
"544","76.334699","149.90.40.13","130.166.120.72","TCP","18194","[TCP Window Full] 80  >  52668 [PSH, ACK] Seq=1916712 Ack=467 Win=64768 Len=18128 TSval=3610687697 TSecr=3625133443"
"545","76.334755","130.166.120.72","149.90.40.13","TCP","66","[TCP ZeroWindow] 52668  >  80 [ACK] Seq=467 Ack=1934840 Win=0 Len=0 TSval=3625133443 TSecr=3610687697"
"546","76.335610","130.166.120.72","149.90.40.13","TCP","66","[TCP Window Update] 52668  >  80 [ACK] Seq=467 Ack=1934840 Win=140032 Len=0 TSval=3625133444 TSecr=3610687697"
"547","76.335755","149.90.40.13","130.166.120.72","TCP","47098","80  >  52668 [PSH, ACK] Seq=1934840 Ack=467 Win=64768 Len=47032 TSval=3610687698 TSecr=3625133444"
"548","76.335756","149.90.40.13","130.166.120.72","TCP","65226","80  >  52668 [PSH, ACK] Seq=1981872 Ack=467 Win=64768 Len=65160 TSval=3610687698 TSecr=3625133444"
"549","76.335757","149.90.40.13","130.166.120.72","TCP","27906","[TCP Window Full] 80  >  52668 [PSH, ACK] Seq=2047032 Ack=467 Win=64768 Len=27840 TSval=3610687698 TSecr=3625133444"
"550","76.335858","130.166.120.72","149.90.40.13","TCP","66","52668  >  80 [ACK] Seq=467 Ack=2074872 Win=70016 Len=0 TSval=3625133444 TSecr=3610687698"
"551","76.336061","149.90.40.13","130.166.120.72","TCP","37386","80  >  52668 [PSH, ACK] Seq=2074872 Ack=467 Win=64768 Len=37320 TSval=3610687698 TSecr=3625133444"
"552","76.336062","149.90.40.13","130.166.120.72","TCP","32762","[TCP Window Full] 80  >  52668 [PSH, ACK] Seq=2112192 Ack=467 Win=64768 Len=32696 TSval=3610687698 TSecr=3625133444"
"553","76.336129","130.166.120.72","149.90.40.13","TCP","66","[TCP ZeroWindow] 52668  >  80 [ACK] Seq=467 Ack=2144888 Win=0 Len=0 TSval=3625133445 TSecr=3610687698"
"554","76.336618","130.166.120.72","149.90.40.13","TCP","66","[TCP Window Update] 52668  >  80 [ACK] Seq=467 Ack=2144888 Win=152448 Len=0 TSval=3625133445 TSecr=3610687698"
"555","76.336704","149.90.40.13","130.166.120.72","TCP","32530","80  >  52668 [PSH, ACK] Seq=2144888 Ack=467 Win=64768 Len=32464 TSval=3610687699 TSecr=3625133445"
"556","76.336706","149.90.40.13","130.166.120.72","TCP","34444","80  >  52668 [PSH, ACK] Seq=2177352 Ack=467 Win=64768 Len=34378 TSval=3610687699 TSecr=3625133445"
"557","76.336793","130.166.120.72","149.90.40.13","TCP","66","52668  >  80 [ACK] Seq=467 Ack=2211730 Win=119040 Len=0 TSval=3625133445 TSecr=3610687699"
"558","76.337417","130.166.120.72","149.90.40.13","TCP","66","[TCP Window Update] 52668  >  80 [ACK] Seq=467 Ack=2211730 Win=349312 Len=0 TSval=3625133446 TSecr=3610687699"
"559","76.339753","130.166.120.72","149.90.40.13","TCP","66","52668  >  80 [FIN, ACK] Seq=467 Ack=2211730 Win=364928 Len=0 TSval=3625133448 TSecr=3610687699"
"560","76.339976","149.90.40.13","130.166.120.72","TCP","66","80  >  52668 [FIN, ACK] Seq=2211730 Ack=468 Win=64768 Len=0 TSval=3610687703 TSecr=3625133448"
"561","76.339984","130.166.120.72","149.90.40.13","TCP","66","52668  >  80 [ACK] Seq=468 Ack=2211731 Win=364928 Len=0 TSval=3625133449 TSecr=3610687703"
"562","80.380088","HewlettP_9b:05:9b","Apple_9c:e7:14","ARP","42","Who has 130.166.120.72? Tell 130.166.120.11"
"563","80.380115","Apple_9c:e7:14","HewlettP_9b:05:9b","ARP","42","130.166.120.72 is at 78:3a:84:9c:e7:14"
